,title,url,summary,topic
337,Clean Development Mechanism(CDM)-,https://medium.com/@wealthywaste/clean-development-mechanism-cdm-d7f14b662bdd?source=tag_recommended_feed---------1-85----------kyoto_protocol----------0293a3b4_6f82_469a_813b_9b26599baf01-------,The Clean Development Mechanism(CDM) is a product of the Kyoto Protocol which proves beneficial for both industry as well as climate…,Climate Action
338,Unlock Rewards and Join the Kyoto Protocol Waiting List Competition for a Chance to Win Big!,https://medium.com/@lastfridayartwork/unlock-rewards-and-join-the-kyoto-protocol-waiting-list-competition-for-a-chance-to-win-big-7f966da7221b?source=tag_recommended_feed---------2-84----------kyoto_protocol----------0293a3b4_6f82_469a_813b_9b26599baf01-------,"Are you ready for an exciting opportunity to be a part of the Kyoto Protocol Waiting List Competition? Get ready to climb the ranks, earn…",Climate Action
339,India and the Kyoto Protocol,https://medium.com/@rpatil5999/india-and-the-kyoto-protocol-276cf03c3f0d?source=tag_recommended_feed---------3-85----------kyoto_protocol----------0293a3b4_6f82_469a_813b_9b26599baf01-------,"The Kyoto Protocol was adopted on the 11th of December 1997, it had a long ratification period and finally came into force on the 16th of…",Climate Action
340,Can ozone hole solve the climate crisis?,https://medium.com/@rdoztaskin/can-ozone-hole-solve-the-climate-crisis-b0c741fed059?source=tag_recommended_feed---------4-84----------kyoto_protocol----------0293a3b4_6f82_469a_813b_9b26599baf01-------,"Remember the ozone hole? Or do you know how the ozone hole issue, on which disaster scenarios were written, is today?",Climate Action
341,International norms to regulate the emission of carbon dioxide,https://medium.com/@gunjangoyal14/international-norms-to-regulate-the-emission-of-carbon-dioxide-dd8a44b40a31?source=tag_recommended_feed---------5-85----------kyoto_protocol----------0293a3b4_6f82_469a_813b_9b26599baf01-------,"These norms were based on the Kyoto protocol. This protocol was adopted on Dec 11, 1997, in Kyoto, Japan, but implemented on Feb 16th…",Climate Action
342,KyotoProtocol AMA Recap Crypto Revolution Masters Community,https://medium.com/@cryptorevolution/kyotoprotocol-ama-recap-crypto-revolution-masters-community-cc22581def9?source=tag_recommended_feed---------6-84----------kyoto_protocol----------0293a3b4_6f82_469a_813b_9b26599baf01-------,"KyotoProtocol conducted an AMA in Crypto Revolution Masters Community. Our guest was Kyoto Ken, The CCO of the project. Let’s take a look…",Climate Action
343,Remember the Kyoto Protocol?,https://medium.com/@francavilla/remember-the-kyoto-protocol-553838b5c8ca?source=tag_recommended_feed---------7-84----------kyoto_protocol----------0293a3b4_6f82_469a_813b_9b26599baf01-------,What happened and what we’re doing now about climate change,Climate Action
344,Cudos Partnered with KyotoProtocol to achieve Carbon Neutrality,https://medium.com/@cryptorajhindi/cudos-partnered-with-kyotoprotocol-to-achieve-carbon-neutrality-1e6b75418df?source=tag_recommended_feed---------8-84----------kyoto_protocol----------0293a3b4_6f82_469a_813b_9b26599baf01-------,"On Earth day 22nd April 2022, Cudos makes one more important partnership with KyotoProtocol.io to achieve its mission of a sustainable…",Climate Action
345,Cudos and KyotoProtocol.io enter carbon offsetting partnership,https://medium.com/cudos/cudos-and-kyotoprotocol-io-enter-carbon-offsetting-partnership-4d6f3a5fc75b?source=tag_recommended_feed---------9-84----------kyoto_protocol----------0293a3b4_6f82_469a_813b_9b26599baf01-------,"On Earth Day, we are delighted to join hands with the world’s first fully optimised carbon credit protocol, KyotoProtocol.io, to offset our…",Climate Action
346,"Don’t plant trees. Wait, what now?",https://medium.com/@vidyalekshmih/dont-plant-trees-wait-what-now-bc5c61fba095?source=tag_recommended_feed---------0-84----------afforestation----------354aa5d5_d476_40f1_bdb5_978d1a866629-------,"For the past few decades, activists and commoners like us have been planting trees believing that we are saving our planet. However, some…",Climate Action
347,Project “Aashi Upavan”: Cultivating Greener & Sustainable Future through Afforestation and Soil…,https://medium.com/@mithilgada/project-aashi-upavan-cultivating-greener-sustainable-future-through-afforestation-and-soil-0caeffa19fa3?source=tag_recommended_feed---------1-85----------afforestation----------354aa5d5_d476_40f1_bdb5_978d1a866629-------,"A Project Report by Mithil Gada, High School Senior, Nalanda International School, Vadodara",Climate Action
348,Create Your Own Microforest,https://medium.com/@TheTribalist/create-your-own-microforest-a76c71700edd?source=tag_recommended_feed---------2-84----------afforestation----------354aa5d5_d476_40f1_bdb5_978d1a866629-------,Lawns represent one of the worst types of monocultures where one species takes up an extensive amount of space which limits the types of…,Climate Action
349,Cultivating Corporate Sustainability: Biodiversity Conservation and CSR,https://medium.com/@ebadatibnbabar/cultivating-corporate-sustainability-biodiversity-conservation-and-csr-297b4e03a205?source=tag_recommended_feed---------3-85----------afforestation----------354aa5d5_d476_40f1_bdb5_978d1a866629-------,Biodiversity conservation is increasingly recognized as a potent instrument for businesses to fulfill their Corporate Social Responsibility…,Climate Action
350,"AFFORESTATION AND ITS POSITIVE ENVIRONMENTAL IMPACT
I am delighted to write to you about…",https://medium.com/@preciousawonge/afforestation-and-its-positive-environmental-impact-i-am-delighted-to-write-to-you-about-70483371ad47?source=tag_recommended_feed---------4-84----------afforestation----------354aa5d5_d476_40f1_bdb5_978d1a866629-------,What's a tree to me?,Climate Action
351,Creative Afforestation Slogans for a Healthier Planet,https://medium.com/@muhammadahmeed0x/creative-afforestation-slogans-for-a-healthier-planet-2b527cba9604?source=tag_recommended_feed---------5-85----------afforestation----------354aa5d5_d476_40f1_bdb5_978d1a866629-------,Welcome to an inspiring journey through a collection of compelling Afforestation Slogans that echo the call for environmental renewal. In a…,Climate Action
352,The Realities of Reforestation,https://medium.com/reworld/the-realities-of-reforestation-461b64758aa5?source=tag_recommended_feed---------6-84----------afforestation----------354aa5d5_d476_40f1_bdb5_978d1a866629-------,"Global reforestation is one of the primary solutions used by countries, businesses, and local communities alike to boost carbon…",Climate Action
353,Indian forest man Jadav Payeng,https://medium.com/@exterenergy/indian-forest-man-jadav-payeng-e6f5396c3e6c?source=tag_recommended_feed---------7-85----------afforestation----------354aa5d5_d476_40f1_bdb5_978d1a866629-------,"Why you need to know about Jadav Payeng, the forest man of India, who turned 1,360 Acres of barren land into one of the best man-made…",Climate Action
354,Youth-led Organization as the Future for Addressing SDGs in Local Communities: A Case Study of…,https://medium.com/@GeoTE/youth-led-organization-as-the-future-for-addressing-sdgs-in-local-communities-a-case-study-of-6b88e3e71416?source=tag_recommended_feed---------8-84----------afforestation----------354aa5d5_d476_40f1_bdb5_978d1a866629-------,Introduction:,Climate Action
355,AGRICULTURE PROJECT TOPICS AND MATERIALS,https://medium.com/@iprojectng/agriculture-project-topics-and-materials-41cf4de391ba?source=tag_recommended_feed---------9-85----------afforestation----------354aa5d5_d476_40f1_bdb5_978d1a866629-------,"EFFECT OF WATER STRESS, ABSCISIC ACID AND PROLINE ON COTTON PLANTS",Climate Action
356,Introducing $PARKS: The Solana Token Driving Reforestation Efforts Worldwide,https://medium.com/@prim1988/introducing-parks-the-solana-token-driving-reforestation-efforts-worldwide-a4845744f2a9?source=tag_recommended_feed---------0-84----------reforestation----------d6bdcc68_1d5b_4c32_9fad_f8ec0295bee2-------,"In a world where environmental concerns are increasingly at the forefront of our collective consciousness, innovative solutions are needed…",Climate Action
357,Missing the Ecosystems for the Trees,https://medium.com/@cooldesign/missing-the-ecosystems-for-the-trees-3677ab29a204?source=tag_recommended_feed---------1-107----------reforestation----------d6bdcc68_1d5b_4c32_9fad_f8ec0295bee2-------,Will planting trees get us out of our climate pickle? Not entirely. But it could increase the world’s natural drawdown of atmospheric…,Climate Action
358,AAREY FOREST CASE (Case Study),https://medium.com/@samveg0909/aarey-forest-case-a8bf2dc301b5?source=tag_recommended_feed---------2-85----------reforestation----------d6bdcc68_1d5b_4c32_9fad_f8ec0295bee2-------,INTRODUCTION.,Climate Action
359,Earth Day & Six Months in Nature Tech,https://medium.com/@sophiarwood/earth-day-six-months-in-nature-tech-06bb324490be?source=tag_recommended_feed---------3-84----------reforestation----------d6bdcc68_1d5b_4c32_9fad_f8ec0295bee2-------,"It seems fitting that my six-month anniversary at Pachama would fall on Earth Day 2024. In the past six months, I’ve followed an intense…",Climate Action
360,Trovador: Tree Planting Robot,https://medium.com/@martabernardino1/trovador-tree-planting-robot-2dc44facae70?source=tag_recommended_feed---------4-85----------reforestation----------d6bdcc68_1d5b_4c32_9fad_f8ec0295bee2-------,The Gap,Climate Action
361,Announcing Operation WebTree: A Global Web3 Reforestation Movement,https://medium.com/@silvitree/announcing-operation-webtree-a-global-web3-reforestation-movement-c8d542cfcce9?source=tag_recommended_feed---------5-84----------reforestation----------d6bdcc68_1d5b_4c32_9fad_f8ec0295bee2-------,What happens when you gather community-based reforestation projects led by web3 enthusiasts from around the world?,Climate Action
362,Vlinder mangrove project in Indonesia is selected for the carbon portfolio of Julius Baer,https://medium.com/vlinder-app/vlinder-mangrove-project-in-indonesia-is-selected-for-the-carbon-portfolio-of-julius-baer-07af4a092237?source=tag_recommended_feed---------6-85----------reforestation----------d6bdcc68_1d5b_4c32_9fad_f8ec0295bee2-------,"With their support, we will restore 500 hectares of mangrove forest, providing new jobs and livelihoods for 3000 people in North Sumatra.",Climate Action
363,How reforestation works?,https://medium.com/@spacegarden/how-reforestation-works-8051e776848e?source=tag_recommended_feed---------7-84----------reforestation----------d6bdcc68_1d5b_4c32_9fad_f8ec0295bee2-------,Using pioneer trees and fixing soil damage,Climate Action
364,CamBIO ECO Colectivo And The Reforestation of Santa Fe’s Ravine.,https://medium.com/@y4c/cambio-eco-colectivo-and-the-reforestration-of-santa-fes-ravine-f1ac95085866?source=tag_recommended_feed---------8-85----------reforestation----------d6bdcc68_1d5b_4c32_9fad_f8ec0295bee2-------,Author: Diana Alejandra García Najera,Climate Action
365,Climate Impact: Transforming the Planet with Klippa Relocation — Klippa Relocation,https://medium.com/@stuart.beaty/climate-impact-transforming-the-planet-with-klippa-relocation-klippa-relocation-3ad7d1026fa2?source=tag_recommended_feed---------9-84----------reforestation----------d6bdcc68_1d5b_4c32_9fad_f8ec0295bee2-------,"In the face of the looming climate crisis, the need for impactful climate action has never been more pressing. Klippa is rising to the…",Climate Action
366,"Climate Change, Solved",https://medium.com/@iwoj/climate-change-solved-244b41e1c414?source=tag_recommended_feed---------0-84----------carbon_sequestration----------2d84166f_ba65_4e2d_9d13_00bc1987e821-------,No summary available,Climate Action
367,"Protect the ozone, protect the planet",https://medium.com/the-new-climate/protect-the-ozone-protect-the-planet-74ea34b5855?source=tag_recommended_feed---------1-107----------carbon_sequestration----------2d84166f_ba65_4e2d_9d13_00bc1987e821-------,The ozone layer does more than protect us from sunburn,Climate Action
368,How many trees would we need to plant to stop global warming?,https://medium.com/@tgof137/how-many-trees-would-we-need-to-plant-to-stop-global-warming-1343d1e58e8d?source=tag_recommended_feed---------2-85----------carbon_sequestration----------2d84166f_ba65_4e2d_9d13_00bc1987e821-------,Some people think the answer to global warming is negative emissions. The IPCC is counting on this plan working.,Climate Action
369,Unlocking Carbon Credits Through Agricultural Practices,https://medium.com/@clearrating/unlocking-carbon-credits-through-agricultural-practices-dfd2bead11a0?source=tag_recommended_feed---------3-84----------carbon_sequestration----------2d84166f_ba65_4e2d_9d13_00bc1987e821-------,"In the journey for sustainable climate solutions, agricultural solutions provide great potential for carbon credit generation, offering a…",Climate Action
370,Is Carbon Sequestration Good or Bad?,https://medium.com/@rootsshootsfruitsseo/is-carbon-sequestration-good-or-bad-c2970d165963?source=tag_recommended_feed---------4-85----------carbon_sequestration----------2d84166f_ba65_4e2d_9d13_00bc1987e821-------,Carbon sequestration is the process of capturing and storing carbon dioxide (CO2) to prevent it from entering the atmosphere. This…,Climate Action
371,What if we Think in Carbon Cycles rather than carbon storage?,https://medium.com/forestbase/what-if-we-think-in-carbon-cycles-rather-than-carbon-storage-6d6756c7ff6b?source=tag_recommended_feed---------5-84----------carbon_sequestration----------2d84166f_ba65_4e2d_9d13_00bc1987e821-------,How Operations Management and concepts like throughput and system capacity are very much at play when we talk about carbon.,Climate Action
372,Why Non-Nature-Based Credits Are the Future of Carbon Markets,https://medium.com/@capturiant/why-non-nature-based-credits-are-the-future-of-carbon-markets-908497766c76?source=tag_recommended_feed---------6-85----------carbon_sequestration----------2d84166f_ba65_4e2d_9d13_00bc1987e821-------,"The landscape of carbon offsetting is rapidly evolving. Historically, nature-based credits, particularly those generated by forestry and…",Climate Action
373,agribazaar’s Role in Advancing Carbon Sequestration Efforts in India!,https://medium.com/@agribazaar/agribazaars-role-in-advancing-carbon-sequestration-efforts-in-india-5f3b16ffa8d0?source=tag_recommended_feed---------7-84----------carbon_sequestration----------2d84166f_ba65_4e2d_9d13_00bc1987e821-------,"Carbon sequestration, capturing and storing carbon dioxide (CO2) from the atmosphere, is critical in combating climate change. India has…",Climate Action
374,How do you make biochar?,https://medium.com/earthly-biochar/how-do-you-make-biochar-c3028981050d?source=tag_recommended_feed---------8-85----------carbon_sequestration----------2d84166f_ba65_4e2d_9d13_00bc1987e821-------,This is one of the most popular questions when it comes to biochar. We have synthesised our learnings from the past 3 years and broken it…,Climate Action
375,The path to a green economy cannot wish away fossil fuels for the foreseeable future,https://medium.com/illumination/the-path-to-a-green-economy-cannot-wish-away-fossil-fuels-for-the-foreseeable-future-c421026eb7e4?source=tag_recommended_feed---------9-84----------carbon_sequestration----------2d84166f_ba65_4e2d_9d13_00bc1987e821-------,That the world needs to transition to a green economy and follow an alternate vision of growth and development that is both…,Climate Action
376,Digital Tools for Climate,https://medium.com/@cityfi/digital-tools-for-climate-c8c864ffd7b0?source=tag_recommended_feed---------0-84----------green_infrastructure----------35bd659c_1f8a_48a2_af31_911f8ae6cabf-------,By Alexander Kapur,Climate Action
377,Trees As Infrastructure,https://medium.com/hub-engine/trees-as-infrastructure-1dd94e1cfedf?source=tag_recommended_feed---------1-85----------green_infrastructure----------35bd659c_1f8a_48a2_af31_911f8ae6cabf-------,An open source model to support municipalities in transitioning toward resilient urban forest management practices,Climate Action
378,The Rise of Green Bonds: Financing a Sustainable Future,https://medium.com/@reomartins4/the-rise-of-green-bonds-financing-a-sustainable-future-b6b142cce62c?source=tag_recommended_feed---------2-84----------green_infrastructure----------35bd659c_1f8a_48a2_af31_911f8ae6cabf-------,"In the rich variety of financial instruments, green bonds have emerged as a beacon of hope and innovation. As we navigate the pressing…",Climate Action
379,Trees As Infrastructure,https://medium.com/hub-engine/trees-as-infrastructure-aa141acdf227?source=tag_recommended_feed---------3-85----------green_infrastructure----------35bd659c_1f8a_48a2_af31_911f8ae6cabf-------,An open source model to support municipalities in transitioning towards resilient urban forest management practices,Climate Action
380,A swimable creek,https://medium.com/@niawag/a-swimable-creek-720344a445c4?source=tag_recommended_feed---------4-84----------green_infrastructure----------35bd659c_1f8a_48a2_af31_911f8ae6cabf-------,"On a hot summer afternoon, in the not-so-distant future, I want to grab a towel and some flip flops and wander down to my favorite swimming…",Climate Action
381,Looking at Cooling Benefits of Plants Through NYC Vegetation Data,https://medium.com/@NYCEJA/looking-at-cooling-benefits-of-plants-through-nyc-vegetation-data-56945fa2927d?source=tag_recommended_feed---------5-85----------green_infrastructure----------35bd659c_1f8a_48a2_af31_911f8ae6cabf-------,"NYC neighborhoods are known to vary in local cuisine and culture, but a new analysis from the Just Nature NYC Partnership shows that in…",Climate Action
382,Is Yonkers Future Green?,https://medium.com/@groundworkhv/is-yonkers-future-green-86fa9605dd24?source=tag_recommended_feed---------6-84----------green_infrastructure----------35bd659c_1f8a_48a2_af31_911f8ae6cabf-------,Yonkers Students Leading the Way in Creating Sustainable Solutions for Stormwater Runoff,Climate Action
383,The Future of Stormwater Management: Emerging Trends,https://medium.com/@rainplan/stormwater-management-is-an-essential-aspect-of-urban-planning-and-environmental-conservation-but-0bce43879ecc?source=tag_recommended_feed---------7-85----------green_infrastructure----------35bd659c_1f8a_48a2_af31_911f8ae6cabf-------,Stormwater management is an essential aspect of urban planning and environmental conservation but it’s not the topic that sizzles quite…,Climate Action
384,"Water, Water Everywhere: Soaking Up Our Most Precious Resource",https://medium.com/read-or-die/water-water-everywhere-soaking-up-our-most-precious-resource-ee19c9e1ee91?source=tag_recommended_feed---------8-84----------green_infrastructure----------35bd659c_1f8a_48a2_af31_911f8ae6cabf-------,Why I Get Weirdly Excited About Wonky-Looking Curbs,Climate Action
385,Parallel Simulations and Green Infrastructure Analysis with PySWMM,https://medium.com/hydroinformatics/parallel-simulations-and-green-infrastructure-analysis-with-pyswmm-dbf79409b73e?source=tag_recommended_feed---------9-85----------green_infrastructure----------35bd659c_1f8a_48a2_af31_911f8ae6cabf-------,"PySWMM, a Python wrapper for the EPA Storm Water Management Model (SWMM), has become a powerful tool for simulating stormwater systems and…",Climate Action
386,How Fin-tech Could Solve Bengaluru’s Billion-Dollar Traffic Problem,https://medium.com/@eswarprasanth/how-fin-tech-could-solve-bengalurus-billion-dollar-traffic-problem-05c61de27388?source=tag_recommended_feed---------0-84----------urban_planning----------b3d18337_49b6_4dc9_82f7_99e422f50f89-------,Setting the Scene,Climate Action
387,Breathing Life Into Cities,https://medium.com/the-environment/breathing-life-into-cities-cafb078daff5?source=tag_recommended_feed---------1-107----------urban_planning----------b3d18337_49b6_4dc9_82f7_99e422f50f89-------,"Green Spaces as Necessities, Not Niceties",Climate Action
388,Public Transport Accessibility in Python,https://medium.com/towards-data-science/public-transport-accessibility-in-python-dbdeee99f36f?source=tag_recommended_feed---------2-85----------urban_planning----------b3d18337_49b6_4dc9_82f7_99e422f50f89-------,"In this piece, I explore the availability of public transport by using GTFS data and Python-based spatial analytics libraries.",Climate Action
389,The artistic flair inspiring greener European cities,https://medium.com/symbiotica/the-artistic-flair-inspiring-greener-european-cities-51aeaf48f7d5?source=tag_recommended_feed---------3-107----------urban_planning----------b3d18337_49b6_4dc9_82f7_99e422f50f89-------,Arts and culture can bring imagination and momentum to projects for putting urban neighbourhoods more in tune with nature.,Climate Action
390,Green Roofs in Urban Environments,https://medium.com/@victoriayoung209/green-roofs-in-urban-environments-a4ea3f7ebba4?source=tag_recommended_feed---------4-85----------urban_planning----------b3d18337_49b6_4dc9_82f7_99e422f50f89-------,Benefits and Challenges,Climate Action
391,Front Porch Series: Life in a 15-Minute City,https://medium.com/@nicole.dejacimo/front-porch-series-life-in-a-15-minute-city-2b4bf9131603?source=tag_recommended_feed---------5-84----------urban_planning----------b3d18337_49b6_4dc9_82f7_99e422f50f89-------,By Nicole DeJacimo,Climate Action
392,"Neighbourhood green space is in rapid decline, deepening both the climate and mental health crises",https://medium.com/symbiotica/neighbourhood-green-space-is-in-rapid-decline-deepening-both-the-climate-and-mental-health-crises-431c8a438ba0?source=tag_recommended_feed---------6-107----------urban_planning----------b3d18337_49b6_4dc9_82f7_99e422f50f89-------,"By Matthew Adams, Principal Lecturer in Psychology, University of Brighton",Climate Action
393,Let’s Talk About Mud Flood,https://medium.com/@danatwilliams/lets-talk-about-mud-flood-763bede47ff6?source=tag_recommended_feed---------7-85----------urban_planning----------b3d18337_49b6_4dc9_82f7_99e422f50f89-------,I don’t think it’s very controversial for me to say that there’s a lot of bad history content on the internet. That may be slowly changing…,Climate Action
394,Urban Planning: A Terceira Via,https://medium.com/@iheringguedes/urban-planning-a-terceira-via-e780780dce5d?source=tag_recommended_feed---------8-84----------urban_planning----------b3d18337_49b6_4dc9_82f7_99e422f50f89-------,A brief survey of recent theoretical literatureon the ends and means of urban planning suggests a deepening chasm between social and…,Climate Action
395,Why is Socialist Housing so Ugly,https://medium.com/@marjankrebelj/why-is-socialist-housing-so-ugly-e88aff71b0af?source=tag_recommended_feed---------9-107----------urban_planning----------b3d18337_49b6_4dc9_82f7_99e422f50f89-------,Or is it?,Climate Action
396,Our Tiny Forest in the Desert is blooming.,https://medium.com/flow-the-desert/our-tiny-forest-in-the-desert-is-blooming-894aecc9600a?source=tag_recommended_feed---------0-84----------climate_resilience----------f1ddf57c_5504_495d_a5a5_cc930ef711d3-------,We planted two 100sqft forests in the middle of the Mojave. Here’s an update on how our desert forest dream is doing.,Climate Action
397,Opportunities in Precision Agriculture,https://medium.com/mercy-corps-social-venture-fund/opportunities-in-precision-agriculture-ae8cfffa7b53?source=tag_recommended_feed---------1-85----------climate_resilience----------f1ddf57c_5504_495d_a5a5_cc930ef711d3-------,A deep dive on the most promising sub-sectors for smallholder farmers in emerging markets,Climate Action
398,"Kenya Dam Burst Tragedy: 42 Dead,  Rescue Ops Underway To Find Survivors",https://medium.com/@ketankashyap2249/kenya-dam-burst-tragedy-42-dead-rescue-ops-underway-to-find-survivors-8f0489883b5a?source=tag_recommended_feed---------2-84----------climate_resilience----------f1ddf57c_5504_495d_a5a5_cc930ef711d3-------,No summary available,Climate Action
399,Announcing the Crypto For Good Fund III: crypto for climate and financial resilience in the Global…,https://medium.com/mercy-corps-social-venture-fund/announcing-the-crypto-for-good-fund-iii-crypto-for-climate-and-financial-resilience-in-the-global-80e6d5c0c81e?source=tag_recommended_feed---------3-85----------climate_resilience----------f1ddf57c_5504_495d_a5a5_cc930ef711d3-------,This edition of the Crypto For Good Fund III will be focused on the next frontier of crypto innovation in the Global South.,Climate Action
400,"Building Resilience, Saving Lives",https://medium.com/@uswblogger/building-resilience-saving-lives-5253b991c9e2?source=tag_recommended_feed---------4-84----------climate_resilience----------f1ddf57c_5504_495d_a5a5_cc930ef711d3-------,"By David McCall
USW International President",Climate Action
401,Climate Tech Facility — Ecosystem Insights,https://medium.com/mercy-corps-social-venture-fund/climate-tech-facility-ecosystem-insights-5ce48baa8b5a?source=tag_recommended_feed---------5-85----------climate_resilience----------f1ddf57c_5504_495d_a5a5_cc930ef711d3-------,"We provide an overview of the climate tech landscape in emerging markets, based on 412 proposals received from our Climate Tech Facility.",Climate Action
402,Food vs. Climate: This Secret Weapon Can Save Both,https://medium.com/@optimizationpros/food-vs-climate-this-secret-weapon-can-save-both-89e5c080f659?source=tag_recommended_feed---------6-84----------climate_resilience----------f1ddf57c_5504_495d_a5a5_cc930ef711d3-------,"Imagine a world where crops thrive amidst a changing climate, where food security goes hand-in-hand with environmental protection. It’s not…",Climate Action
