title,topic,title_combined
Rethinking Solutionism: Why We Need More Awareness and Sensitivity in Climate Action,1,rethink/Rethinking solution/Solutionism need/Need awar/Awareness sensit/Sensitivity climat/Climate action/Action
Why I Willingly Gave A Third Party Remote Access to My Home Battery,1,willingli/Willingly gave/Gave third/Third parti/Party remot/Remote access/Access home/Home batteri/Battery
The Colorado River Basin Is Disappearing Into Fast Food Menus,1,colorado/Colorado river/River basin/Basin disappear/Disappearing fast/Fast food/Food menu/Menus
Why Toniic members invested in Fervo Energy’s $244M Series D,1,toniic/Toniic member/Members invest/Invested fervo/Fervo energi/Energys 244m/244M seri/Series
Are Christian Values At Odds With Climate Change Activism?,1,christian/Christian valu/Values odd/Odds climat/Climate chang/Change activ/Activism
Too Many Other Problems To Care About Climate Change?,1,mani/Many problem/Problems care/Care climat/Climate chang/Change
Breakdown (The Intern),1,breakdown/Breakdown intern/Intern
Why Isn’t Everyone Talking About Sustainable Bioeconomies?,1,isnt/Isnt everyon/Everyone talk/Talking sustain/Sustainable bioeconomi/Bioeconomies
Think Scientists Disagree on Climate Change? Think Again!,1,think/Think scientist/Scientists disagre/Disagree climat/Climate chang/Change think/Think
Rethinking wind power’s towers and turbines,1,rethink/Rethinking wind/Wind power/Powers tower/Towers turbin/Turbines
Way Past W.T.F.,1,way/Way past/Past wtf/Wtf
Where did the water go?,1,water/Water go/Go
Why Aren’t We All Starving?,1,arent/Arent starv/Starving
Why Are Emperor Penguin Chicks Leaping Off 50-Foot Cliffs in Antarctica?,1,emperor/Emperor penguin/Penguin chick/Chicks leap/Leaping 50foot/50Foot cliff/Cliffs antarctica/Antarctica
It’s Official: March Was the 10th Straight Month to be Hottest on Record,1,offici/Official march/March 10th/10Th straight/Straight month/Month hottest/Hottest record/Record
The Winter Of Our Karma,1,winter/Winter karma/Karma
House of the Midnight Sun,1,hous/House midnight/Midnight sun/Sun
Stop Being Poor,1,stop/Stop poor/Poor
The increase in biological carbon absorption near the coasts has been associated with river…,1,increas/Increase biolog/Biological carbon/Carbon absorpt/Absorption near/Near coast/Coasts associ/Associated river/River
It’s Getting Easier To Have Climate Stories Greenlighted,1,get/Getting easier/Easier climat/Climate stori/Stories greenlight/Greenlighted
Resize Image Before Upload in Laravel 9 Example,1,resiz/Resize imag/Image upload/Upload laravel/Laravel exampl/Example
Carbon Fiber: Words…on Facts,1,carbon/Carbon fiber/Fiber wordson/Wordson fact/Facts
World’s oldest trees reveal the largest solar storm in history,1,world/Worlds oldest/Oldest tree/Trees reveal/Reveal largest/Largest solar/Solar storm/Storm histori/History
One quick way to get ready for Carbon v11,1,one/One quick/Quick way/Way get/Get readi/Ready carbon/Carbon v11/V11
Low Carbon Chic — Let’s Go Loud!,1,low/Low carbon/Carbon chic/Chic let/Lets go/Go loud/Loud
Moving forward: On deprecating carbon-components and carbon-components-react,1,move/Moving forward/Forward deprec/Deprecating carboncompon/Carboncomponents carboncomponentsreact/Carboncomponentsreact
Drained peatland in Sweden turns out to be a carbon sink,1,drain/Drained peatland/Peatland sweden/Sweden turn/Turns carbon/Carbon sink/Sink
True DEX Limit Orders: Carbon vs. Existing Solutions,1,true/True dex/Dex limit/Limit order/Orders carbon/Carbon vs/Vs exist/Existing solut/Solutions
FARM Emissions — Week 189,1,farm/Farm emiss/Emissions week/Week
Are Solving the Climate Crisis and Ending Poverty Compatible Goals?,1,solv/Solving climat/Climate crisi/Crisis end/Ending poverti/Poverty compat/Compatible goal/Goals
PION’s Next Strategic Step: Adjusting Emissions,1,pion/Pions next/Next strateg/Strategic step/Step adjust/Adjusting emiss/Emissions
How did Emissions dropped in the United States,1,emiss/Emissions drop/Dropped unit/United state/States
What’s the Impact of the Space Industry on Climate Change?,1,what/Whats impact/Impact space/Space industri/Industry climat/Climate chang/Change
Justin Trudeau says “Provinces must Price Carbon as part of the Removal of the Federal Carbon Tax,1,justin/Justin trudeau/Trudeau say/Says provinc/Provinces must/Must price/Price carbon/Carbon part/Part remov/Removal feder/Federal carbon/Carbon tax/Tax
FARM Emissions — Week 188,1,farm/Farm emiss/Emissions week/Week
AI writing emits less carbon than humans,1,ai/Ai write/Writing emit/Emits less/Less carbon/Carbon human/Humans
Estimating coal power plant operation from satellite images with computer vision,1,estim/Estimating coal/Coal power/Power plant/Plant oper/Operation satellit/Satellite imag/Images comput/Computer vision/Vision
Why Carbon? Voluntary Markets History,1,carbon/Carbon voluntari/Voluntary market/Markets histori/History
AI Will Solve Climate Change!,1,ai/Ai solv/Solve climat/Climate chang/Change
The Earth’s Life-Giving Atmosphere,1,earth/Earths lifegiv/Lifegiving atmospher/Atmosphere
How Decarbonization And Clean Renewable Green Hydrogen Energy Help Reduce Greenhouse Gas,1,decarbon/Decarbonization clean/Clean renew/Renewable green/Green hydrogen/Hydrogen energi/Energy help/Help reduc/Reduce greenhous/Greenhouse ga/Gas
Why are HVAC systems important?,1,hvac/Hvac system/Systems import/Important
Global warming | Climate change | Green house gases,1,global/Global warm/Warming climat/Climate chang/Change green/Green hous/House gase/Gases
The Greenhouse Gas Protocol's Corporate Standard — Plain and Simple,1,greenhous/Greenhouse ga/Gas protocol/Protocols corpor/Corporate standard/Standard plain/Plain simpl/Simple
"Navigating the Shell Climate Case: A Comprehensive Analysis of Legal, Environmental, and Economic…",1,navig/Navigating shell/Shell climat/Climate case/Case comprehens/Comprehensive analysi/Analysis legal/Legal environment/Environmental econom/Economic
What is carbon neutral with examples?,1,carbon/Carbon neutral/Neutral exampl/Examples
Navigating Sustainability Seas: Thai Union’s Comprehensive Strategy for Decarbonizing the Shrimp…,1,navig/Navigating sustain/Sustainability sea/Seas thai/Thai union/Unions comprehens/Comprehensive strategi/Strategy decarbon/Decarbonizing shrimp/Shrimp
Greenhouse gas emissions from dog poop,1,greenhous/Greenhouse ga/Gas emiss/Emissions dog/Dog poop/Poop
Kairos Aerospace Rebrands as Insight M,1,kairo/Kairos aerospac/Aerospace rebrand/Rebrands insight/Insight
Issue 87: Methane,1,issu/Issue methan/Methane
Do Humans Fart More Methane Than Cows?,1,human/Humans fart/Fart methan/Methane cow/Cows
Why I started Agteria Biotech,1,start/Started agteria/Agteria biotech/Biotech
Cow farts are not a major source of global warming,1,cow/Cow fart/Farts major/Major sourc/Source global/Global warm/Warming
What Fuels Do SpaceX Rockets Use?,1,fuel/Fuels spacex/Spacex rocket/Rockets use/Use
EARTH & US: World Water Day 2024…The Power of Poop!,1,earth/Earth us/Us world/World water/Water day/Day 2024the/2024The power/Power poop/Poop
The Global Warming Potential of Methane,1,global/Global warm/Warming potenti/Potential methan/Methane
Methane VS Hydrogen — The Battle of Gases,1,methan/Methane vs/Vs hydrogen/Hydrogen battl/Battle gase/Gases
Carbon Sinks Are Becoming Carbon Sources,1,carbon/Carbon sink/Sinks becom/Becoming carbon/Carbon sourc/Sources
Extremely Low CO2 is Not Needed,1,extrem/Extremely low/Low co2/Co2 need/Needed
Intro to Monitoring CO2,1,intro/Intro monitor/Monitoring co2/Co2
Scientists have refuted the sharp drop in carbon dioxide concentrations in 1610,1,scientist/Scientists refut/Refuted sharp/Sharp drop/Drop carbon/Carbon dioxid/Dioxide concentr/Concentrations
What is the simplest way for converting CO2 to O2?,1,simplest/Simplest way/Way convert/Converting co2/Co2 o2/O2
CO2 Indoors,1,co2/Co2 indoor/Indoors
CO2 valorisation: methods & competitive landscape,1,co2/Co2 valoris/Valorisation method/Methods competit/Competitive landscap/Landscape
CO2 Pipelines Risks,1,co2/Co2 pipelin/Pipelines risk/Risks
Don’t bury money: how to create value from CO2,1,dont/Dont buri/Bury money/Money creat/Create valu/Value co2/Co2
Carbonated Air,1,carbon/Carbonated air/Air
Rogue Emissions,1,rogu/Rogue emiss/Emissions
Climate Change: Fact or Fiction?,1,climat/Climate chang/Change fact/Fact fiction/Fiction
Starbucks Created Coffee Seeds That Can Survive Climate Change,1,starbuck/Starbucks creat/Created coffe/Coffee seed/Seeds surviv/Survive climat/Climate chang/Change
The Crisis Report — 32,1,crisi/Crisis report/Report
The ‘P’ Word,1,p/P word/Word
These Places Might not Exist in the Future,1,place/Places might/Might exist/Exist futur/Future
Why was Year 536 AD the Worst Year to be Alive?,1,year/Year ad/Ad worst/Worst year/Year aliv/Alive
Can this startup stop climate change?,1,startup/Startup stop/Stop climat/Climate chang/Change
Springtime Weather and Birds Arrive Early,1,springtim/Springtime weather/Weather bird/Birds arriv/Arrive earli/Early
How Did Medieval People Survive The Winters?,1,mediev/Medieval peopl/People surviv/Survive winter/Winters
World Sees 10th Consecutive Hottest Month on Record as March Temperatures Soar to Unseen Levels,1,world/World see/Sees 10th/10Th consecut/Consecutive hottest/Hottest month/Month record/Record march/March temperatur/Temperatures soar/Soar unseen/Unseen level/Levels
The hottest month ever,1,hottest/Hottest month/Month ever/Ever
IPCC Report On Impacts: More Than A Warning,1,ipcc/Ipcc report/Report impact/Impacts warn/Warning
Global Warming a Research,1,global/Global warm/Warming research/Research
"STOP TEMPERATURE RISING: Past, present and future of average surface temperature",1,stop/Stop temperatur/Temperature rise/Rising past/Past present/Present futur/Future averag/Average surfac/Surface temperatur/Temperature
What’s Wrong with a Little Heat?,1,what/Whats wrong/Wrong littl/Little heat/Heat
Sea Level Rise in the United States,1,sea/Sea level/Level rise/Rise unit/United state/States
"Ancient Antarctic ice melt caused extreme sea-level rise 129,000 years ago — and it could happen…",1,ancient/Ancient antarct/Antarctic ice/Ice melt/Melt caus/Caused extrem/Extreme sealevel/Sealevel rise/Rise year/Years ago/Ago could/Could happen/Happen
Glacier Melting and its effects on natural habitats — WeeklyReviewer,1,glacier/Glacier melt/Melting effect/Effects natur/Natural habitat/Habitats weeklyreview/Weeklyreviewer
Climate and Antarctica part 3,1,climat/Climate antarctica/Antarctica part/Part
Climate and Antarctica part 2,1,climat/Climate antarctica/Antarctica part/Part
Arctic claims!,1,arctic/Arctic claim/Claims
Charleston & Sea Level Rise,1,charleston/Charleston sea/Sea level/Level rise/Rise
The Millstone Meltdown,1,millston/Millstone meltdown/Meltdown
Extreme Ice Sheet Retreat,1,extrem/Extreme ice/Ice sheet/Sheet retreat/Retreat
Solving for Sea Level Rise,1,solv/Solving sea/Sea level/Level rise/Rise
Impact of Rising Sea Levels on Coastal Residential Real Estate Assets,1,impact/Impact rise/Rising sea/Sea level/Levels coastal/Coastal residenti/Residential real/Real estat/Estate asset/Assets
COUNTERACTING THE FLOODING RISK,1,counteract/Counteracting flood/Flooding risk/Risk
Direct Air Capture of CO2 Is Needed After the World Reaches Net Zero Emissions,1,direct/Direct air/Air captur/Capture co2/Co2 need/Needed world/World reach/Reaches net/Net zero/Zero emiss/Emissions
Sea level rising and its impacts in Bangladesh,1,sea/Sea level/Level rise/Rising impact/Impacts bangladesh/Bangladesh
Forecasting Ocean Rhythms,1,forecast/Forecasting ocean/Ocean rhythm/Rhythms
From Atlantis to Nice; What else will be lost to climate change?,1,atlanti/Atlantis nice/Nice els/Else lost/Lost climat/Climate chang/Change
AI-Driven Breakthrough: Advancing Precipitation Mapping for Climate Resilience,1,aidriven/Aidriven breakthrough/Breakthrough advanc/Advancing precipit/Precipitation map/Mapping climat/Climate resili/Resilience
Combine many netCDF files into a single file with Python,1,combin/Combine mani/Many netcdf/Netcdf file/Files singl/Single file/File python/Python
A new critical look at climate models,1,new/New critic/Critical look/Look climat/Climate model/Models
Limited-area Numerical Weather Prediction Modelling Efforts in Europe,1,limitedarea/Limitedarea numer/Numerical weather/Weather predict/Prediction model/Modelling effort/Efforts europ/Europe
Analysis-ready climate data with ESMValCore,1,analysisreadi/Analysisready climat/Climate data/Data esmvalcor/Esmvalcore
AI Brings Secret Superpowers to Battle Climate Change,1,ai/Ai bring/Brings secret/Secret superpow/Superpowers battl/Battle climat/Climate chang/Change
ESMValTool: Recipes for solid climate science,1,esmvaltool/Esmvaltool recip/Recipes solid/Solid climat/Climate scienc/Science
Climate modelling: from Manabe and Wetherald to supercomputer JASMIN,1,climat/Climate model/Modelling manab/Manabe wetherald/Wetherald supercomput/Supercomputer jasmin/Jasmin
A New Generation of Climate Models,1,new/New gener/Generation climat/Climate model/Models
"Climate models need ocean data, 
 as a failed El Niño prediction shows.",1,climat/Climate model/Models need/Need ocean/Ocean data/Data fail/Failed el/El nio/Nio predict/Prediction show/Shows
Title: The Unyielding Grip of Global Warming: A Call to Action,1,titl/Title unyield/Unyielding grip/Grip global/Global warm/Warming call/Call action/Action
"Protect the ozone, protect the planet",1,protect/Protect ozon/Ozone protect/Protect planet/Planet
How Can You Minimize Further Damage To The Ozone Layer For Better Life?,1,minim/Minimize damag/Damage ozon/Ozone layer/Layer better/Better life/Life
U.S. Supreme Court to Hear Challenge to EPA Regulation on Ozone Emissions,1,us/Us suprem/Supreme court/Court hear/Hear challeng/Challenge epa/Epa regul/Regulation ozon/Ozone emiss/Emissions
What are the major problems of indiscriminate use of resource?,1,major/Major problem/Problems indiscrimin/Indiscriminate use/Use resourc/Resource
The Ozone Layer: Earth’s Invisible Shield,1,ozon/Ozone layer/Layer earth/Earths invis/Invisible shield/Shield
Ozone hole — The Consequence of Ozone Layer Depletion — Shouts,1,ozon/Ozone hole/Hole consequ/Consequence ozon/Ozone layer/Layer deplet/Depletion shout/Shouts
Protection of Our Planet: Global Strategies to Mitigate Ozone Layer Depletion,1,protect/Protection planet/Planet global/Global strategi/Strategies mitig/Mitigate ozon/Ozone layer/Layer deplet/Depletion
Title: NASA’s X-59 ‘Quiet’ Supersonic Jet Gets Patriotic Paint Job Ahead of Historic Flight,1,titl/Title nasa/Nasas x59/X59 quiet/Quiet superson/Supersonic jet/Jet get/Gets patriot/Patriotic paint/Paint job/Job ahead/Ahead histor/Historic flight/Flight
"Ozone, satellites, and climate change",1,ozon/Ozone satellit/Satellites climat/Climate chang/Change
Why Drought May Hurt Your Mental Health and How Forests Can Help,1,drought/Drought may/May hurt/Hurt mental/Mental health/Health forest/Forests help/Help
The Tipping Point.,1,tip/Tipping point/Point
I Lost Peace,1,lost/Lost peac/Peace
I’d Rather Go Dirty Than Watch My Garden Die,1,id/Id rather/Rather go/Go dirti/Dirty watch/Watch garden/Garden die/Die
Early peak at summer outlook,1,earli/Early peak/Peak summer/Summer outlook/Outlook
Overcoming Drought withDrought-Tolerant Plants,1,overcom/Overcoming drought/Drought withdroughttoler/Withdroughttolerant plant/Plants
"My Laundry-to-Landscape Greywater System Will Take a 25,000 Gallon Bite Out of the Drought",1,laundrytolandscap/Laundrytolandscape greywat/Greywater system/System take/Take gallon/Gallon bite/Bite drought/Drought
The Ancient Sacred Ritual,1,ancient/Ancient sacr/Sacred ritual/Ritual
Facing the Dry Spell: The Global Impact of Drought on Farmers in 2024,1,face/Facing dri/Dry spell/Spell global/Global impact/Impact drought/Drought farmer/Farmers
A Journey from Home to School,1,journey/Journey home/Home school/School
Staying Strong When Disaster Strikes,1,stay/Staying strong/Strong disast/Disaster strike/Strikes
The Power of SAR Data and Google Earth Engine in Flood Area Mapping,1,power/Power sar/Sar data/Data googl/Google earth/Earth engin/Engine flood/Flood area/Area map/Mapping
Integrated Flood Mapping and Analysis: Post-Cyclone Yaas using ENVI SARscape analytics and ArcGIS…,1,integr/Integrated flood/Flood map/Mapping analysi/Analysis postcyclon/Postcyclone yaa/Yaas use/Using envi/Envi sarscap/Sarscape analyt/Analytics arcgi/Arcgis
Bridging the adaptation gap: can the circular economy help?,1,bridg/Bridging adapt/Adaptation gap/Gap circular/Circular economi/Economy help/Help
5 Most flood affected areas in Chennai due to Michaung Cyclone,1,flood/Flood affect/Affected area/Areas chennai/Chennai due/Due michaung/Michaung cyclon/Cyclone
Destiny of the God’s own Country,1,destini/Destiny god/Gods countri/Country
SEC and Climate Change,1,sec/Sec climat/Climate chang/Change
Unleash Macof: An Essential Ethical Hacking Tool for Network Security,1,unleash/Unleash macof/Macof essenti/Essential ethic/Ethical hack/Hacking tool/Tool network/Network secur/Security
The Ides of March,1,ide/Ides march/March
Climate Stories 12th April 2024,1,climat/Climate stori/Stories 12th/12Th april/April
Upending the Climate Hockey Stick,1,upend/Upending climat/Climate hockey/Hockey stick/Stick
Europe Warms Twice as Fast as Other Continents,1,europ/Europe warm/Warms twice/Twice fast/Fast contin/Continents
Spring That Never Came,1,spring/Spring never/Never came/Came
Will the Climate Crisis Trigger Nuclear War?,1,climat/Climate crisi/Crisis trigger/Trigger nuclear/Nuclear war/War
Embracing the Unpredictable: Navigating Britain’s Varied Weather Patterns,1,embrac/Embracing unpredict/Unpredictable navig/Navigating britain/Britains vari/Varied weather/Weather pattern/Patterns
Extinction Level Event — The Weather is Becoming Deadlier More Quickly Than Scientists Anticipated,1,extinct/Extinction level/Level event/Event weather/Weather becom/Becoming deadlier/Deadlier quickli/Quickly scientist/Scientists anticip/Anticipated
A Confabulation of Reports,1,confabul/Confabulation report/Reports
It’s cold and people want to shoot transformers. Are you ready?,1,cold/Cold peopl/People want/Want shoot/Shoot transform/Transformers readi/Ready
How to Find My Weather Code for Rainmeter,1,find/Find weather/Weather code/Code rainmet/Rainmeter
Uninsured Texas Homes Lost to Wildfires,1,uninsur/Uninsured texa/Texas home/Homes lost/Lost wildfir/Wildfires
"What 2,500 years of wildfire evidence and the extreme fire seasons of 1910 and 2020 tell us about…",1,year/Years wildfir/Wildfire evid/Evidence extrem/Extreme fire/Fire season/Seasons tell/Tell us/Us
"I, Climate Refugee",1,climat/Climate refuge/Refugee
Wildfire Mitigation and the State of Hawaii,1,wildfir/Wildfire mitig/Mitigation state/State hawaii/Hawaii
Coyotes are here to stay in North American cities — here’s how to appreciate them from a distance,1,coyot/Coyotes stay/Stay north/North american/American citi/Cities here/Heres appreci/Appreciate distanc/Distance
PC Fan Corsi-Rosenthal Guide,1,pc/Pc fan/Fan corsirosenth/Corsirosenthal guid/Guide
How to Stay Safe While Traveling in a Warming Climate,1,stay/Stay safe/Safe travel/Traveling warm/Warming climat/Climate
Greenwashing set Canada on fire,1,greenwash/Greenwashing set/Set canada/Canada fire/Fire
Fire Tornadoes —  Headline Captivating Enough,1,fire/Fire tornado/Tornadoes headlin/Headline captiv/Captivating enough/Enough
"For a change, lets move away from AI making birthday card images — Meet the innovative BurnBot RX1",1,chang/Change let/Lets move/Move away/Away ai/Ai make/Making birthday/Birthday card/Card imag/Images meet/Meet innov/Innovative burnbot/Burnbot rx1/Rx1
Biodiversity 101: The Latest Science Explained,1,biodivers/Biodiversity latest/Latest scienc/Science explain/Explained
21 Species Removed From The Endangered Species Act Due To Extinction,1,speci/Species remov/Removed endang/Endangered speci/Species act/Act due/Due extinct/Extinction
Doing Something About Biodiversity Loss,1,someth/Something biodivers/Biodiversity loss/Loss
Chaotic weather and the death of birds,1,chaotic/Chaotic weather/Weather death/Death bird/Birds
Living Planet Report 2022: understanding the problem,1,live/Living planet/Planet report/Report understand/Understanding problem/Problem
"Why do we do we love our dogs, even while they are slowly killing us?",1,love/Love dog/Dogs even/Even slowli/Slowly kill/Killing us/Us
A critical summary of the 2017 paper ‘Agriculture production as a major driver of the Earth system…,1,critic/Critical summari/Summary paper/Paper agricultur/Agriculture product/Production major/Major driver/Driver earth/Earth system/System
Revolutionizing African Wildlife Conservation with Drones and AI,1,revolution/Revolutionizing african/African wildlif/Wildlife conserv/Conservation drone/Drones ai/Ai
Path to #ReFi: A personal chronology,1,path/Path refi/Refi person/Personal chronolog/Chronology
"""Lightning Strikes: Unraveling the Menace in Boreal Forests and the Ominous Threat to Carbon…",1,lightn/Lightning strike/Strikes unravel/Unraveling menac/Menace boreal/Boreal forest/Forests omin/Ominous threat/Threat carbon/Carbon
"Significant forest conservation gains in Brazil and Colombia in 2023, but global deforestation…",1,signific/Significant forest/Forest conserv/Conservation gain/Gains brazil/Brazil colombia/Colombia global/Global deforest/Deforestation
Understanding the Amazon Tipping Point,1,understand/Understanding amazon/Amazon tip/Tipping point/Point
The Paradox of Plenty,1,paradox/Paradox plenti/Plenty
Endangered Parrots Threatened By Deforestation And Climate Change,1,endang/Endangered parrot/Parrots threaten/Threatened deforest/Deforestation climat/Climate chang/Change
Today’s land conversion emissions data is inadequate. There’s a better way.,1,today/Todays land/Land convers/Conversion emiss/Emissions data/Data inadequ/Inadequate there/Theres better/Better way/Way
Power to align action — Landscape approaches are here to stay,1,power/Power align/Align action/Action landscap/Landscape approach/Approaches stay/Stay
Keeping your cool in a warming world: 8 steps to help manage eco-anxiety,1,keep/Keeping cool/Cool warm/Warming world/World step/Steps help/Help manag/Manage ecoanxieti/Ecoanxiety
How Satellite Data Is Used to Detect Deforestation,1,satellit/Satellite data/Data use/Used detect/Detect deforest/Deforestation
Haiku — 0098: “Garmi”,1,haiku/Haiku garmi/Garmi
In Search Of America’s Missing Hellbenders,1,search/Search america/Americas miss/Missing hellbend/Hellbenders
Gaza Turning To Desert,1,gaza/Gaza turn/Turning desert/Desert
Issue 80: Deserts,1,issu/Issue desert/Deserts
From desertification to regeneration: back to basics,1,desertif/Desertification regener/Regeneration back/Back basic/Basics
To E/Acc: Greening the Desert for Cheap,1,eacc/Eacc green/Greening desert/Desert cheap/Cheap
Combating desertification — the Portuguese Tribunal de Contas auditing the National Action Program…,1,combat/Combating desertif/Desertification portugues/Portuguese tribun/Tribunal de/De conta/Contas audit/Auditing nation/National action/Action program/Program
Let us reverse desertification globally with some solutions that really work,1,let/Let us/Us revers/Reverse desertif/Desertification global/Globally solut/Solutions realli/Really work/Work
Successful case studies: Reversing Desertification in African Countries,1,success/Successful case/Case studi/Studies revers/Reversing desertif/Desertification african/African countri/Countries
Strawberry Wheelbarrow Love,1,strawberri/Strawberry wheelbarrow/Wheelbarrow love/Love
6 ways to combat drought and desertification,1,way/Ways combat/Combat drought/Drought desertif/Desertification
World Day to Combat Desertification and Drought,1,world/World day/Day combat/Combat desertif/Desertification drought/Drought
Can ‘climate corridors’ help species adapt to warming world?,1,climat/Climate corridor/Corridors help/Help speci/Species adapt/Adapt warm/Warming world/World
The Loss of Salt Marshes,1,loss/Loss salt/Salt marsh/Marshes
The Dangers of Habitat Fragmentation,1,danger/Dangers habitat/Habitat fragment/Fragmentation
Are Polar Bears Going Extinct or Are Their Populations Doing Better Than Ever?,1,polar/Polar bear/Bears go/Going extinct/Extinct popul/Populations better/Better ever/Ever
Matriarch,1,matriarch/Matriarch
A Walk In My Garden,1,walk/Walk garden/Garden
Through the Forest,1,forest/Forest
Predicting the loss of preferred thermal habitats of fish and invertebrates to support future…,1,predict/Predicting loss/Loss prefer/Preferred thermal/Thermal habitat/Habitats fish/Fish invertebr/Invertebrates support/Support futur/Future
From the Welcoming Committee,1,welcom/Welcoming committe/Committee
The Buzzing World of Bees: Understanding the Importance of Pollinators,1,buzz/Buzzing world/World bee/Bees understand/Understanding import/Importance pollin/Pollinators
Thermal Storage Hopium,1,thermal/Thermal storag/Storage hopium/Hopium
Revolutionizing Home Energy with Harmony Wind Turbines,1,revolution/Revolutionizing home/Home energi/Energy harmoni/Harmony wind/Wind turbin/Turbines
"Spain, renewable energy… and the hottest February in history",1,spain/Spain renew/Renewable energi/Energy hottest/Hottest februari/February histori/History
Powering the Future of Home Energy: Unveiling Geneverse's PowerPillar,1,power/Powering futur/Future home/Home energi/Energy unveil/Unveiling genevers/Geneverses powerpillar/Powerpillar
"Unveiling the Power of RENEW — Straight Fire, Son!",1,unveil/Unveiling power/Power renew/Renew straight/Straight fire/Fire son/Son
Puerto Rico needs to transition to renewable energy now,1,puerto/Puerto rico/Rico need/Needs transit/Transition renew/Renewable energi/Energy
