title,topic,title_combined
When was the last time you saw a hailstone in Ghana? How well can you relate to climate change?,1,last/Last time/Time saw/Saw hailston/Hailstone ghana/Ghana well/Well relat/Relate climat/Climate chang/Change
Announcing the Crypto For Good Fund III: crypto for climate and financial resilience in the Global…,1,announc/Announcing crypto/Crypto good/Good fund/Fund iii/Iii crypto/Crypto climat/Climate financi/Financial resili/Resilience global/Global
Empowering Utilities for Resilience: Neara’s AI Revolution in Weather Risk Management,1,empow/Empowering util/Utilities resili/Resilience neara/Nearas ai/Ai revolut/Revolution weather/Weather risk/Risk manag/Management
Leveraging on the World Bank Development Toolkits for Climate Resilient Actions by Developing…,1,leverag/Leveraging world/World bank/Bank develop/Development toolkit/Toolkits climat/Climate resili/Resilient action/Actions develop/Developing
Harnessing Agriculture’s Potential: A Path to Sustainable Food Systems and Climate Resilience,1,har/Harnessing agricultur/Agricultures potenti/Potential path/Path sustain/Sustainable food/Food system/Systems climat/Climate resili/Resilience
Adapting to a new reality (2): Building our Climate Venture Platform,1,adapt/Adapting new/New realiti/Reality build/Building climat/Climate ventur/Venture platform/Platform
Adapting to a new reality (3): Our Climate Assessment,1,adapt/Adapting new/New realiti/Reality climat/Climate assess/Assessment
From Blueprint to Greenprint: Vision for Water Sustainability in Bangalore,1,blueprint/Blueprint greenprint/Greenprint vision/Vision water/Water sustain/Sustainability bangalor/Bangalore
our climate is changing. why aren’t our homes?,1,climat/Climate chang/Changing arent/Arent home/Homes
Revitalizing Agriculture: The Role of Organic Fertilizers in Empowering Smallholder Farmers in…,1,revit/Revitalizing agricultur/Agriculture role/Role organ/Organic fertil/Fertilizers empow/Empowering smallhold/Smallholder farmer/Farmers
Breathing as a System,1,breath/Breathing system/System
DynamoDB: Data partitioning is the secret sauce,1,dynamodb/Dynamodb data/Data partit/Partitioning secret/Secret sauc/Sauce
"Upgrading Adaptive Capacity and Collective Intelligence, Global Coordination and Growth.",1,upgrad/Upgrading adapt/Adaptive capac/Capacity collect/Collective intellig/Intelligence global/Global coordin/Coordination growth/Growth
Risk Analysis: Risk Analyst’s Guide,1,risk/Risk analysi/Analysis risk/Risk analyst/Analysts guid/Guide
Doom Sucks,1,doom/Doom suck/Sucks
Mitigating Hallucinations in LLMs by Enhancing Pre-training Data Quality,1,mitig/Mitigating hallucin/Hallucinations llm/Llms enhanc/Enhancing pretrain/Pretraining data/Data qualiti/Quality
AI’s Double-Edged Sword: Are LLMs the Answer to LLM Threats?,1,ai/Ais doubleedg/Doubleedged sword/Sword llm/Llms answer/Answer llm/Llm threat/Threats
Beating the Heat: Understanding and Combating the Urban Heat Island Effect,1,beat/Beating heat/Heat understand/Understanding combat/Combating urban/Urban heat/Heat island/Island effect/Effect
Feature Essay Project,1,featur/Feature essay/Essay project/Project
"Implementing Bird-Friendly Infrastructure in Municipal Settings: Challenges, Costs, and Evidence",1,implement/Implementing birdfriendli/Birdfriendly infrastructur/Infrastructure municip/Municipal set/Settings challeng/Challenges cost/Costs evid/Evidence
Beat the Shooter: How to Survive Active Shooting in Five Steps,1,beat/Beat shooter/Shooter surviv/Survive activ/Active shoot/Shooting five/Five step/Steps
Understanding and Addressing the Dangers Threatening Earth,1,understand/Understanding address/Addressing danger/Dangers threaten/Threatening earth/Earth
Volcanic Eruptions: A Global Challenge and the Path to Resilience,1,volcan/Volcanic erupt/Eruptions global/Global challeng/Challenge path/Path resili/Resilience
Is the tide turning on climate adaptation funding?,1,tide/Tide turn/Turning climat/Climate adapt/Adaptation fund/Funding
There are no saviours out there,1,saviour/Saviours
We need to start focusing on (and funding) adaptation,1,need/Need start/Start focus/Focusing fund/Funding adapt/Adaptation
"Climate Change 101: Causes, Effects, and Solutions for a Sustainable Future",1,climat/Climate chang/Change caus/Causes effect/Effects solut/Solutions sustain/Sustainable futur/Future
Understanding MSME Resilience to Climate Change,1,understand/Understanding msme/Msme resili/Resilience climat/Climate chang/Change
Seeking Alpha through Decarbonization: A Closer Look at Battery Electric Vehicles,1,seek/Seeking alpha/Alpha decarbon/Decarbonization closer/Closer look/Look batteri/Battery electr/Electric vehicl/Vehicles
“We will not go silently to our watery graves”: How to save a nation from drowning,1,go/Go silent/Silently wateri/Watery grave/Graves save/Save nation/Nation drown/Drowning
Driving MSME Resilience to Climate Change: Designing Right-fit Tools and Solutions,1,drive/Driving msme/Msme resili/Resilience climat/Climate chang/Change design/Designing rightfit/Rightfit tool/Tools solut/Solutions
Revolutionizing climate adaptation financing: The untapped potential of private investment in…,1,revolution/Revolutionizing climat/Climate adapt/Adaptation financ/Financing untap/Untapped potenti/Potential privat/Private invest/Investment
Every Country Must Have This Film Category: Disaster Awareness,1,everi/Every countri/Country must/Must film/Film categori/Category disast/Disaster awar/Awareness
Monitoring a UPS With nut and lighttpd on Linux — Part 1,1,monitor/Monitoring up/Ups nut/Nut lighttpd/Lighttpd linux/Linux part/Part
AI’s take on anticipatory humanitarian action,1,ai/Ais take/Take anticipatori/Anticipatory humanitarian/Humanitarian action/Action
The Importance of Being Prepared Before a Disaster Strikes,1,import/Importance prepar/Prepared disast/Disaster strike/Strikes
Surviving the Tremble: How To Prepare for an Earthquake,1,surviv/Surviving trembl/Tremble prepar/Prepare earthquak/Earthquake
Which Myers Briggs Personality is Best in a Disaster?,1,myer/Myers brigg/Briggs person/Personality best/Best disast/Disaster
The story after Great East Japan Earthquake vol.5：School Survival Story,1,stori/Story great/Great east/East japan/Japan earthquak/Earthquake vol5school/Vol5School surviv/Survival stori/Story
The Importance of Water Storage: Why Every Home Should Have a Plan,1,import/Importance water/Water storag/Storage everi/Every home/Home plan/Plan
Master Survival Skills in 2024: Unleash Your Inner Survivor with the Best Survival Courses,1,master/Master surviv/Survival skill/Skills unleash/Unleash inner/Inner survivor/Survivor best/Best surviv/Survival cours/Courses
Where To Live Around The World To Escape Climate Change,1,live/Live around/Around world/World escap/Escape climat/Climate chang/Change
The Green Revolution: Unveiling the Role of Industrial Hemp in Environmental Restoration,1,green/Green revolut/Revolution unveil/Unveiling role/Role industri/Industrial hemp/Hemp environment/Environmental restor/Restoration
Eternal Edge: A Protracted Verge,1,etern/Eternal edg/Edge protract/Protracted verg/Verge
Knowledge Production in the Ecological Data Economy,1,knowledg/Knowledge product/Production ecolog/Ecological data/Data economi/Economy
We are all of us pebbles,1,us/Us pebbl/Pebbles
"Rachel Corrie, a Witness for our Times",1,rachel/Rachel corri/Corrie wit/Witness time/Times
How Even a Little Sense of Purpose Fights Political Depression,1,even/Even littl/Little sens/Sense purpos/Purpose fight/Fights polit/Political depress/Depression
How Do We Get Here?,1,get/Get
I Got Engaged at the Women’s March,1,got/Got engag/Engaged women/Womens march/March
Are you NEET?,1,neet/Neet
"Despite erratic power supply in Nigeria ,the government still plans on increasing electricity…",1,despit/Despite errat/Erratic power/Power suppli/Supply nigeria/Nigeria govern/Government still/Still plan/Plans increas/Increasing electr/Electricity
Back in the Closet,1,back/Back closet/Closet
From Protest to Policy: Making Change Happen,1,protest/Protest polici/Policy make/Making chang/Change happen/Happen
A Youthful Perspective on Political Action,1,youth/Youthful perspect/Perspective polit/Political action/Action
Forever I will remember,1,forev/Forever rememb/Remember
"“Marcher, Walker, Pilgrim: A Memoir From The Great March For Climate Action” by Ed Fallon book…",1,marcher/Marcher walker/Walker pilgrim/Pilgrim memoir/Memoir great/Great march/March climat/Climate action/Action ed/Ed fallon/Fallon book/Book
Marching for the Future of Food at the People’s Climate March,1,march/Marching futur/Future food/Food peopl/Peoples climat/Climate march/March
Misleading: Photo of litter-filled street does not show the aftermath of climate protest in…,1,mislead/Misleading photo/Photo litterfil/Litterfilled street/Street show/Show aftermath/Aftermath climat/Climate protest/Protest
In 2019 we climate marched… Now what?,1,climat/Climate march/Marched
"The Climate March Was Great, But…",1,climat/Climate march/March great/Great
A Fault,1,fault/Fault
This is not business as usual…..,1,busi/Business usual/Usual
Student Climate Strike — The Road For Change,1,student/Student climat/Climate strike/Strike road/Road chang/Change
"Dear President Trump: Climate Change is Real, and We’ll Never Let You Forget It",1,dear/Dear presid/President trump/Trump climat/Climate chang/Change real/Real well/Well never/Never let/Let forget/Forget
Green Leadership: Driving Sustainable Practices in an Organisation,1,green/Green leadership/Leadership drive/Driving sustain/Sustainable practic/Practices organis/Organisation
10 Creative Strategies for Promoting Sustainable Eco-Friendly Practices,1,creativ/Creative strategi/Strategies promot/Promoting sustain/Sustainable ecofriendli/Ecofriendly practic/Practices
Embracing the Zero Waste Journey: Practical Steps for an Eco-Conscious Lifestyle,1,embrac/Embracing zero/Zero wast/Waste journey/Journey practic/Practical step/Steps ecoconsci/Ecoconscious lifestyl/Lifestyle
Discover the Shocking Scale of Food Waste in Australia!,1,discov/Discover shock/Shocking scale/Scale food/Food wast/Waste australia/Australia
Forging a Future: Sustainable Practices in the Forging Industry,1,forg/Forging futur/Future sustain/Sustainable practic/Practices forg/Forging industri/Industry
Green Pixels: Guidelines to Sustainable Design in Digital Products,1,green/Green pixel/Pixels guidelin/Guidelines sustain/Sustainable design/Design digit/Digital product/Products
Eco-Monitoring Unveiled: Assessing Environmental Impact within Supply Chain Dynamics,1,ecomonitor/Ecomonitoring unveil/Unveiled assess/Assessing environment/Environmental impact/Impact within/Within suppli/Supply chain/Chain dynam/Dynamics
Empowering Change: Our Collective Impact on Plastic Pollution,1,empow/Empowering chang/Change collect/Collective impact/Impact plastic/Plastic pollut/Pollution
Environmental Science and Sustainable Practices: Nurturing Our Planet for Tomorrow,1,environment/Environmental scienc/Science sustain/Sustainable practic/Practices nurtur/Nurturing planet/Planet tomorrow/Tomorrow
Going The Sustainable Way,1,go/Going sustain/Sustainable way/Way
Corporate Responsibility: A Solution for Climate Change,1,corpor/Corporate respons/Responsibility solut/Solution climat/Climate chang/Change
"The Truth About Walmart, McDonald’s, Starbucks and Other US Brands Amid Allegations of Pro-Israel…",1,truth/Truth walmart/Walmart mcdonald/Mcdonalds starbuck/Starbucks us/Us brand/Brands amid/Amid alleg/Allegations proisrael/Proisrael
Neo-Facism and AiOps,1,neofac/Neofacism aiop/Aiops
Nurturing Hearts: Crafting a Culture of Care for Our Future Leaders,1,nurtur/Nurturing heart/Hearts craft/Crafting cultur/Culture care/Care futur/Future leader/Leaders
Towards the future: The unavoidable focus on Scope 3 emissions in corporate responsibility,1,toward/Towards futur/Future unavoid/Unavoidable focu/Focus scope/Scope emiss/Emissions corpor/Corporate respons/Responsibility
The Exploitation of Workers in Developing Countries | China & Bangladesh,1,exploit/Exploitation worker/Workers develop/Developing countri/Countries china/China bangladesh/Bangladesh
3 Strategies to Take Action on Emissions (even when you are bogged down in accounting),1,strategi/Strategies take/Take action/Action emiss/Emissions even/Even bog/Bogged account/Accounting
Here’s how Booking.com creates a positive impact for the Netherlands,1,here/Heres bookingcom/Bookingcom creat/Creates posit/Positive impact/Impact netherland/Netherlands
“Breaking the Glass Ceiling: Society’s Stifled Song of Equality”,1,break/Breaking glass/Glass ceil/Ceiling societi/Societys stifl/Stifled song/Song equal/Equality
Company Sustainability Plan Template,1,compani/Company sustain/Sustainability plan/Plan templat/Template
The Biden Administration IS Working for the American People-Part 1,1,biden/Biden administr/Administration work/Working american/American peoplepart/Peoplepart
Living Green 101: Where do I start?,1,live/Living green/Green start/Start
Thoughts on Carl Sagan’s ‘A Pale Blue Dot’,1,thought/Thoughts carl/Carl sagan/Sagans pale/Pale blue/Blue dot/Dot
Philly’s Annual Spring Clean-Up is Back April 6th,1,philli/Phillys annual/Annual spring/Spring cleanup/Cleanup back/Back april/April 6th/6Th
"The Treadmill of Production: Land, Waste, Food, and Technology",1,treadmil/Treadmill product/Production land/Land wast/Waste food/Food technolog/Technology
The Urban Highway that Started it All: Examining the Impacts of the Cross-Bronx Expressway,1,urban/Urban highway/Highway start/Started examin/Examining impact/Impacts crossbronx/Crossbronx expressway/Expressway
Climate Superfund Laws: Recovering the Cost of Climate Change,1,climat/Climate superfund/Superfund law/Laws recov/Recovering cost/Cost climat/Climate chang/Change
Rest is Resistance: Combating Insomnia’s Racist Origins,1,rest/Rest resist/Resistance combat/Combating insomnia/Insomnias racist/Racist origin/Origins
Suburbs: The Great American Ponzi Scheme,1,suburb/Suburbs great/Great american/American ponzi/Ponzi scheme/Scheme
Introducing SJN’s 2024 Climate Solutions Cohort,1,introduc/Introducing sjn/Sjns climat/Climate solut/Solutions cohort/Cohort
Why SanimaWaale?,0,sanimawaal/Sanimawaale
The 10 Most ‘Totally Traumatizing’ PG-Rated Movies That Generation X Watched as Kids,0,total/Totally traumat/Traumatizing pgrate/Pgrated movi/Movies gener/Generation x/X watch/Watched kid/Kids
My Favourite Underrated Sci-Fi Film: Upgrade,0,favourit/Favourite underr/Underrated scifi/Scifi film/Film upgrad/Upgrade
‘Civil War’ Has More To Say About Journalism Than US Politics,0,civil/Civil war/War say/Say journal/Journalism us/Us polit/Politics
The Haunting Journey of William Peter Blatty,0,haunt/Haunting journey/Journey william/William peter/Peter blatti/Blatty
True Lies — astonishing action tarnished by dated politics,0,true/True lie/Lies astonish/Astonishing action/Action tarnish/Tarnished date/Dated polit/Politics
23 Best Sites to Download Hindi-Dubbed Movies,0,best/Best site/Sites download/Download hindidub/Hindidubbed movi/Movies
Welcome Aboard Con AI,0,welcom/Welcome aboard/Aboard con/Con ai/Ai
I Finally Watched ‘The Omen’ And It Explains My Childhood,0,final/Finally watch/Watched omen/Omen explain/Explains childhood/Childhood
The Conversation — the most underrated film of the 1970s,0,convers/Conversation underr/Underrated film/Film 1970/1970S
The Genesis of Cable Skinny Bundles,0,genesi/Genesis cabl/Cable skinni/Skinny bundl/Bundles
Constellation: Season One — another “multiverse” story loses its way,0,constel/Constellation season/Season one/One anoth/Another multivers/Multiverse stori/Story lose/Loses way/Way
The Challenge All Stars 4 Episodes 1 and 2 Super Recap: 15 Biggest Takeaways,0,challeng/Challenge star/Stars episod/Episodes super/Super recap/Recap biggest/Biggest takeaway/Takeaways
Review: Shogun Is Great TV — But It’s Not About Colonialism,0,review/Review shogun/Shogun great/Great tv/Tv coloni/Colonialism
‘3 Body Problem’ Is an Elegant Reimagining of Deeply Ambitious Source Material,0,bodi/Body problem/Problem eleg/Elegant reimagin/Reimagining deepli/Deeply ambiti/Ambitious sourc/Source materi/Material
The Challenge All Stars 4 Episode 1 Recap — Winners & Losers,0,challeng/Challenge star/Stars episod/Episode recap/Recap winner/Winners loser/Losers
Great News For NASA: New Netflix Show Saves The Agency Decades Of Research Time By Simply Making…,0,great/Great new/News nasa/Nasa new/New netflix/Netflix show/Show save/Saves agenc/Agency decad/Decades research/Research time/Time simpli/Simply make/Making
Ripley: A Cold Neo-Noir Without the Spark (TV Review),0,ripley/Ripley cold/Cold neonoir/Neonoir without/Without spark/Spark tv/Tv review/Review
House of the Midnight Sun,0,hous/House midnight/Midnight sun/Sun
Ranked: Top 13 Laverne Cox Roles (According to IDMB),0,rank/Ranked top/Top lavern/Laverne cox/Cox role/Roles accord/According idmb/Idmb
The Making of VES: the Cosmos Microservice for Netflix Video Encoding,0,make/Making ve/Ves cosmo/Cosmos microservic/Microservice netflix/Netflix video/Video encod/Encoding
Rebuilding Netflix Video Processing Pipeline with Microservices,0,rebuild/Rebuilding netflix/Netflix video/Video process/Processing pipelin/Pipeline microservic/Microservices
Setup your video streaming server for free in a few minutes,0,setup/Setup video/Video stream/Streaming server/Server free/Free minut/Minutes
Counting the Money: Is YouTube’s $2 Billion NFL Deal a Winning Play?,0,count/Counting money/Money youtub/Youtubes billion/Billion nfl/Nfl deal/Deal win/Winning play/Play
"Stream Smarter, Not Harder: A Guide to Using Stremio, Torrentio, and Real Debrid",0,stream/Stream smarter/Smarter harder/Harder guid/Guide use/Using stremio/Stremio torrentio/Torrentio real/Real debrid/Debrid
MIDNIGHT REVIEWS Fallout Episode Two,0,midnight/Midnight review/Reviews fallout/Fallout episod/Episode two/Two
"Actresses Primed to Definitely, Maybe Have a Monumental 2024",0,actress/Actresses prime/Primed definit/Definitely mayb/Maybe monument/Monumental
How to Get Around Netflix’s New Household Policy,0,get/Get around/Around netflix/Netflixs new/New household/Household polici/Policy
Pirate Streams vs. Political Streams,0,pirat/Pirate stream/Streams vs/Vs polit/Political stream/Streams
I Didn’t Like You Very Much When I Met You,0,didnt/Didnt like/Like much/Much met/Met
What’s Unforgettable?,0,what/Whats unforgett/Unforgettable
A Night At the Opera,0,night/Night opera/Opera
Pat Metheny’s “Dream Box Tour” LIVE! at MPAC,0,pat/Pat metheni/Methenys dream/Dream box/Box tour/Tour live/Live mpac/Mpac
"On Tour, Sid Sriram Gets Closer to God",0,tour/Tour sid/Sid sriram/Sriram get/Gets closer/Closer god/God
What You Didn’t Know About Bluesman Albert King at Fillmore East,0,didnt/Didnt know/Know bluesman/Bluesman albert/Albert king/King fillmor/Fillmore east/East
My Concert Misadventure: Part 2,0,concert/Concert misadventur/Misadventure part/Part
A Road Trip to Remember: The Time I Drove R & B Rocker Bo Diddley to His Mississippi Gig,0,road/Road trip/Trip rememb/Remember time/Time drove/Drove r/R b/B rocker/Rocker bo/Bo diddley/Diddley mississippi/Mississippi gig/Gig
"The Eras Tour, Ranked",0,era/Eras tour/Tour rank/Ranked
Best Concert Ever: U2 — Zoo TV,0,best/Best concert/Concert ever/Ever u2/U2 zoo/Zoo tv/Tv
"Civil War — Movie is Not What You Think, But You Still Should See It",0,civil/Civil war/War movi/Movie think/Think still/Still see/See
#OscarsMightNotBeSoWhite: The lack of Diversity at the Oscars may not be solely the Academy’s Fault,0,oscarsmightnotbesowhit/Oscarsmightnotbesowhite lack/Lack divers/Diversity oscar/Oscars may/May sole/Solely academi/Academys fault/Fault
Swift Actors — in depth,0,swift/Swift actor/Actors depth/Depth
"Here’s To You, Cliff Robertson",0,here/Heres cliff/Cliff robertson/Robertson
What Does an Actor’s Commission Pay For?,0,actor/Actors commiss/Commission pay/Pay
AI🌎 Players📢-69,0,ai/Ai players69/Players69
Michael J. Fox,0,michael/Michael j/J fox/Fox
Nickelodeon Truths Are Discoloring My Childhood (But Are Also So Important),0,nickelodeon/Nickelodeon truth/Truths discolor/Discoloring childhood/Childhood also/Also import/Important
Async iniatilization of the SwiftUI app,0,async/Async iniatil/Iniatilization swiftui/Swiftui app/App
What We Talk About When We Talk About Linda Blair,0,talk/Talk linda/Linda blair/Blair
The Brightest Star in the Flanaverse:,0,brightest/Brightest star/Star flanavers/Flanaverse
"Bud Cardos, B-Movie Legend",0,bud/Bud cardo/Cardos bmovi/Bmovie legend/Legend
What’s on Jim’s Mind (Issue #182),0,what/Whats jim/Jims mind/Mind issu/Issue
Are Directors the Sole Author of a Film?,0,director/Directors sole/Sole author/Author film/Film
A Deep Dive into the Directorial Style of Quentin Tarantino,0,deep/Deep dive/Dive directori/Directorial style/Style quentin/Quentin tarantino/Tarantino
Quick Thoughts on “Monkey Man” (2024),0,quick/Quick thought/Thoughts monkey/Monkey man/Man
When Filmmaking Goes Bad,0,filmmak/Filmmaking goe/Goes bad/Bad
Denis Villeneuve’s Neuromancer,0,deni/Denis villeneuv/Villeneuves neuromanc/Neuromancer
The Evolution of AI in Business Development: The Future for Directors,0,evolut/Evolution ai/Ai busi/Business develop/Development futur/Future director/Directors
My Guide to Becoming a Cinephile — Directors (Part 1),0,guid/Guide becom/Becoming cinephil/Cinephile director/Directors part/Part
10 Websites Mastered Storytelling Experience With Exceptional Design Level,0,websit/Websites master/Mastered storytel/Storytelling experi/Experience except/Exceptional design/Design level/Level
"The 96th Academy Awards Was Brisk, Elegant, and Full of Deserving Winners",0,96th/96Th academi/Academy award/Awards brisk/Brisk eleg/Elegant full/Full deserv/Deserving winner/Winners
10 Websites With Exceptional Button Design That Will Definitely Inspire You,0,websit/Websites except/Exceptional button/Button design/Design definit/Definitely inspir/Inspire
Top Sites Of The Week That Will Definitely Inspire You — Dose #2415,0,top/Top site/Sites week/Week definit/Definitely inspir/Inspire dose/Dose
The Top GIFs From the 2024 EE BAFTA Film Awards,0,top/Top gif/Gifs ee/Ee bafta/Bafta film/Film award/Awards
Design Innovation With 10 Webflow-Powered Websites To Inspire You,0,design/Design innov/Innovation webflowpow/Webflowpowered websit/Websites inspir/Inspire
Cory Bauer selected as Top Civil Engineer of the Decade by IAOTP,0,cori/Cory bauer/Bauer select/Selected top/Top civil/Civil engin/Engineer decad/Decade iaotp/Iaotp
Who Should Win at the 2024 Oscars?,0,win/Win oscar/Oscars
Total Eclipse of my Life…Not!,0,total/Total eclips/Eclipse lifenot/Lifenot
Outgrow Is a Winner in G2 Fall Awards 2023 | 98%+ Client Recommendations,0,outgrow/Outgrow winner/Winner g2/G2 fall/Fall award/Awards client/Client recommend/Recommendations
Home Lab Setup with Hyper-V Part 3,0,home/Home lab/Lab setup/Setup hyperv/Hyperv part/Part
Remembering the Sinclair ZX81,0,rememb/Remembering sinclair/Sinclair zx81/Zx81
How To Activate Windows 10 Using Command Prompt (cmd),0,activ/Activate window/Windows use/Using command/Command prompt/Prompt cmd/Cmd
Conscious AI,0,consciou/Conscious ai/Ai
Remembering the IBM PC and Compatibles,0,rememb/Remembering ibm/Ibm pc/Pc compat/Compatibles
The Computer Programmers’ $150/hour Racket Is Over,0,comput/Computer programm/Programmers 150hour/150Hour racket/Racket
Why Computers in School? A Theory,0,comput/Computers school/School theori/Theory
The amazing M3 iMac — 1 month later,0,amaz/Amazing m3/M3 imac/Imac month/Month later/Later
Transfer Files To a USB Drive Via the Command Line,0,transfer/Transfer file/Files usb/Usb drive/Drive via/Via command/Command line/Line
"Apple M3: If you build it, will they come?",0,appl/Apple m3/M3 build/Build come/Come
"Skip the Neighborhood Walk Score, What’s Your Dive Bar Walk Score?",0,skip/Skip neighborhood/Neighborhood walk/Walk score/Score what/Whats dive/Dive bar/Bar walk/Walk score/Score
Is ‘Dirty Lemon’ in Paris the World’s Chicest Queer Cocktail Bar?,0,dirti/Dirty lemon/Lemon pari/Paris world/Worlds chicest/Chicest queer/Queer cocktail/Cocktail bar/Bar
"Cocktails or Mocktails, That is the Question",0,cocktail/Cocktails mocktail/Mocktails question/Question
Sensational Spring and Summer Cocktail Recipes and Cuisine Pairings at a Glance,0,sensat/Sensational spring/Spring summer/Summer cocktail/Cocktail recip/Recipes cuisin/Cuisine pair/Pairings glanc/Glance
Can San Francisco handle another Prohibition-era bar?,0,san/San francisco/Francisco handl/Handle anoth/Another prohibitionera/Prohibitionera bar/Bar
Mixed Murder,0,mix/Mixed murder/Murder
5 Essential Steps to Building Your First Home Bar,0,essenti/Essential step/Steps build/Building first/First home/Home bar/Bar
I’m the Cocktail Lady,0,im/Im cocktail/Cocktail ladi/Lady
Perfect Mimosa Brunch Pairings,0,perfect/Perfect mimosa/Mimosa brunch/Brunch pair/Pairings
New ‘Blue Room’ mixes timeless cocktails with live music in Lower Nob Hill,0,new/New blue/Blue room/Room mix/Mixes timeless/Timeless cocktail/Cocktails live/Live music/Music lower/Lower nob/Nob hill/Hill
Meet the People Behind Your Morning Coffee,0,meet/Meet peopl/People behind/Behind morn/Morning coffe/Coffee
Starbucks Created Coffee Seeds That Can Survive Climate Change,0,starbuck/Starbucks creat/Created coffe/Coffee seed/Seeds surviv/Survive climat/Climate chang/Change
Starbucks Has Lost Its Damn Mind,0,starbuck/Starbucks lost/Lost damn/Damn mind/Mind
Mornings Don’t Feel The Same Without It,0,morn/Mornings dont/Dont feel/Feel without/Without
"At This Unique Harajuku Cafe, Everyone’s Your Friend",0,uniqu/Unique harajuku/Harajuku cafe/Cafe everyon/Everyones friend/Friend
