title,topic,title_combined
The Ethical Dilemmas of Renewable Energy Development,1,ethic/Ethical dilemma/Dilemmas renew/Renewable energi/Energy develop/Development
Soapstoned Ritual 197,1,soapston/Soapstoned ritual/Ritual
Unleashing the Power of Plug and Play Solar Panels in Europe,1,unleash/Unleashing power/Power plug/Plug play/Play solar/Solar panel/Panels europ/Europe
Solar power occupies a lot of space — here’s how to make it more ecologically beneficial to the…,1,solar/Solar power/Power occupi/Occupies lot/Lot space/Space here/Heres make/Make ecolog/Ecologically benefici/Beneficial
Can hybrid solar inverter work without battery?,1,hybrid/Hybrid solar/Solar invert/Inverter work/Work without/Without batteri/Battery
Pakistan Gearing Up for a Solar Eclipse! Here’s How to See It Safely,1,pakistan/Pakistan gear/Gearing solar/Solar eclips/Eclipse here/Heres see/See safe/Safely
Why aren’t we installing solar panels on every available space?,1,arent/Arent instal/Installing solar/Solar panel/Panels everi/Every avail/Available space/Space
The Ultimate Guide to 1 MW Solar Power Plant Cost and Profit,1,ultim/Ultimate guid/Guide mw/Mw solar/Solar power/Power plant/Plant cost/Cost profit/Profit
Solar Power Problems and Solutions: Shedding Light on Renewable Energy Challenges,1,solar/Solar power/Power problem/Problems solut/Solutions shed/Shedding light/Light renew/Renewable energi/Energy challeng/Challenges
#5 Let’s Make Electricity — Part 2: Components and Costs,1,let/Lets make/Make electr/Electricity part/Part compon/Components cost/Costs
Part 5: Going Solar,1,part/Part go/Going solar/Solar
"Difference between MW, MWp and MWh",1,differ/Difference mw/Mw mwp/Mwp mwh/Mwh
Don’t take my word for it: the science shows that wind turbines do not harm birdlife,1,dont/Dont take/Take word/Word scienc/Science show/Shows wind/Wind turbin/Turbines harm/Harm birdlif/Birdlife
Meteorology 101: How To Plot Wind Map,1,meteorolog/Meteorology plot/Plot wind/Wind map/Map
The Wind’s New Algorithm: Optimizing Power with TD3 Deep Reinforcement Learning,1,wind/Winds new/New algorithm/Algorithm optim/Optimizing power/Power td3/Td3 deep/Deep reinforc/Reinforcement learn/Learning
Nuclear vs Wind and Solar Energy: A Comprehensive Comparison of Costs and Benefits,1,nuclear/Nuclear vs/Vs wind/Wind solar/Solar energi/Energy comprehens/Comprehensive comparison/Comparison cost/Costs benefit/Benefits
Wind power generation is ‘very predictable’,1,wind/Wind power/Power gener/Generation predict/Predictable
"UK Govt rejects request to share whale stranding data, fuelling suspicions over offshore wind farms.",1,uk/Uk govt/Govt reject/Rejects request/Request share/Share whale/Whale strand/Stranding data/Data fuell/Fuelling suspicion/Suspicions offshor/Offshore wind/Wind farm/Farms
Renewable Energy Expansion: Overcoming Barriers to Solar and Wind Power,1,renew/Renewable energi/Energy expans/Expansion overcom/Overcoming barrier/Barriers solar/Solar wind/Wind power/Power
Wind energy for dummies,1,wind/Wind energi/Energy dummi/Dummies
Top Wind Turbine Manufacturers in 2023: China’s Dominance Increases,1,top/Top wind/Wind turbin/Turbine manufactur/Manufacturers china/Chinas domin/Dominance increas/Increases
Block reward mining: $20M facility gets green light in Kyrgyzstan,1,block/Block reward/Reward mine/Mining 20m/20M facil/Facility get/Gets green/Green light/Light kyrgyzstan/Kyrgyzstan
"As Ethiopian dam fills, tensions rise",1,ethiopian/Ethiopian dam/Dam fill/Fills tension/Tensions rise/Rise
Industrial Beauty,1,industri/Industrial beauti/Beauty
"World News, Business, & Politics Is Actually Relevant to Journalism",1,world/World new/News busi/Business polit/Politics actual/Actually relev/Relevant journal/Journalism
Are We There Yet? Building the Grid of the Future,1,yet/Yet build/Building grid/Grid futur/Future
"Biomass, Bulldozers and Greenwashing- Our Renewed Obsession With Industry",1,biomass/Biomass bulldoz/Bulldozers greenwash/Greenwashing renew/Renewed obsess/Obsession industri/Industry
MONITORING BIOMASS PRODUCTION FROM NPP IN THE GOOGLE EARTH ENGINE,1,monitor/Monitoring biomass/Biomass product/Production npp/Npp googl/Google earth/Earth engin/Engine
Decarbonization Conversations: Anoxic Marine Basins May Help Mitigate Climate Change,1,decarbon/Decarbonization convers/Conversations anox/Anoxic marin/Marine basin/Basins may/May help/Help mitig/Mitigate climat/Climate chang/Change
PETROLEUM ENGINEERING PROJECT TOPICS AND MATERIALS,1,petroleum/Petroleum engin/Engineering project/Project topic/Topics materi/Materials
Biomass: A Small But Important Piece Of The Climate Solution Puzzle,1,biomass/Biomass small/Small import/Important piec/Piece climat/Climate solut/Solution puzzl/Puzzle
Global Market Study on Biomass Boiler : Disruption Due to Emerging Digital Technologies To Spur…,1,global/Global market/Market studi/Study biomass/Biomass boiler/Boiler disrupt/Disruption due/Due emerg/Emerging digit/Digital technolog/Technologies spur/Spur
Benthic Sequestration of Carbon,1,benthic/Benthic sequestr/Sequestration carbon/Carbon
Getting BECCS right,1,get/Getting becc/Beccs right/Right
PLENO’s Reference Area Algorithm for Carbon Removal Forecasting 🌿,1,pleno/Plenos refer/Reference area/Area algorithm/Algorithm carbon/Carbon remov/Removal forecast/Forecasting
Top Biomass briquette supplier in Haryana,1,top/Top biomass/Biomass briquett/Briquette supplier/Supplier haryana/Haryana
Issue 120: Volcanoes,1,issu/Issue volcano/Volcanoes
Deep Energy Exploration & Production: A Modest Quest to the Center of the Earth,1,deep/Deep energi/Energy explor/Exploration product/Production modest/Modest quest/Quest center/Center earth/Earth
The Road Day 4: Old Faithful,1,road/Road day/Day old/Old faith/Faithful
"What is a binary cycle geothermal plant, and how does it work?",1,binari/Binary cycl/Cycle geotherm/Geothermal plant/Plant work/Work
Kenya’s Geothermal Engine Revs Up with Indonesia and UAE,1,kenya/Kenyas geotherm/Geothermal engin/Engine rev/Revs indonesia/Indonesia uae/Uae
Geothermal Well Drilling: How Does It Work?,1,geotherm/Geothermal well/Well drill/Drilling work/Work
Clean Geothermal Energy: Let’s Do More!,1,clean/Clean geotherm/Geothermal energi/Energy let/Lets
Lease Option: Geothermal Borefield,1,leas/Lease option/Option geotherm/Geothermal borefield/Borefield
A Geothermal Plant in Indonesia Has 447% Stock Price Growth Since it’s IPO (In Less Than A Month),1,geotherm/Geothermal plant/Plant indonesia/Indonesia stock/Stock price/Price growth/Growth sinc/Since ipo/Ipo less/Less month/Month
A History of Geothermal Energy,1,histori/History geotherm/Geothermal energi/Energy
Uniplaces Introduces Energy Certificate Feature for Enhanced Property Listings,1,uniplac/Uniplaces introduc/Introduces energi/Energy certif/Certificate featur/Feature enhanc/Enhanced properti/Property list/Listings
Why High-Efficiency Appliances Aren’t the Best Way to Save the Planet,1,higheffici/Highefficiency applianc/Appliances arent/Arent best/Best way/Way save/Save planet/Planet
Would You Purchase a Tesla Tiny Home,1,would/Would purchas/Purchase tesla/Tesla tini/Tiny home/Home
What is next for Heat Pumps?,1,next/Next heat/Heat pump/Pumps
A Carbon-Neutral Plan to Air Condition the World,1,carbonneutr/Carbonneutral plan/Plan air/Air condit/Condition world/World
Why we invested in Phaidra,1,invest/Invested phaidra/Phaidra
Utilizing Mathematical Concepts to Enhance Energy Conservation Practices,1,util/Utilizing mathemat/Mathematical concept/Concepts enhanc/Enhance energi/Energy conserv/Conservation practic/Practices
Heat Pumps are as good at Cooling as Air Conditioners. I Can Prove It.,1,heat/Heat pump/Pumps good/Good cool/Cooling air/Air condition/Conditioners prove/Prove
A Bright Future,1,bright/Bright futur/Future
"""Shining a Light on the Future: The Promise of Light-Matter Particle Displays""",1,shine/Shining light/Light futur/Future promis/Promise lightmatt/Lightmatter particl/Particle display/Displays
Alpha Astra #1,1,alpha/Alpha astra/Astra
Why You Must Embrace Your Failures Without Allowing Other People to Define Them,1,must/Must embrac/Embrace failur/Failures without/Without allow/Allowing peopl/People defin/Define
Tesla’s Worse Nightmare Just Got A Huge Upgrade,1,tesla/Teslas wors/Worse nightmar/Nightmare got/Got huge/Huge upgrad/Upgrade
"Tesla is in it for the long haul, yet playing pragmatics too",1,tesla/Tesla long/Long haul/Haul yet/Yet play/Playing pragmat/Pragmatics
On Radical Acceptance,1,radic/Radical accept/Acceptance
Swap Circle: Behind The Scenes.,1,swap/Swap circl/Circle behind/Behind scene/Scenes
I Use Half as Much Electricity as the Average American. Join Me. (Part 2),1,use/Use half/Half much/Much electr/Electricity averag/Average american/American join/Join part/Part
Books That Explore Sustainable Futures,1,book/Books explor/Explore sustain/Sustainable futur/Futures
"Either We Get SMART, Or USA’s Freedoms Are At-Risk!",1,either/Either get/Get smart/Smart usa/Usas freedom/Freedoms atrisk/Atrisk
I Met an Elephant Who Thinks She’s A Buffalo,1,met/Met eleph/Elephant think/Thinks she/Shes buffalo/Buffalo
Pennsylvania’s Saturday Deer Opener — 5 years in review.,1,pennsylvania/Pennsylvanias saturday/Saturday deer/Deer open/Opener year/Years review/Review
The Wildlife Economy In Africa & Unlocking Its Full Potential,1,wildlif/Wildlife economi/Economy africa/Africa unlock/Unlocking full/Full potenti/Potential
Victoria Duck Hunting: Conservationists Face Criticism Again,1,victoria/Victoria duck/Duck hunt/Hunting conservationist/Conservationists face/Face critic/Criticism
When Einstein acted as a magician,1,einstein/Einstein act/Acted magician/Magician
Why Don’t YOU Try Living With Elephants?,1,dont/Dont tri/Try live/Living eleph/Elephants
Invasive Ants Disrupt Lions’ Hunting Behavior In Kenya,1,invas/Invasive ant/Ants disrupt/Disrupt lion/Lions hunt/Hunting behavior/Behavior kenya/Kenya
How Can Individuals Contribute To Climate Neutrality Efforts?,1,individu/Individuals contribut/Contribute climat/Climate neutral/Neutrality effort/Efforts
The Net Zero Bicycle?,1,net/Net zero/Zero bicycl/Bicycle
BlackRock Embraces RWA Tokenization: A Game-Changer for Viridis Network?,1,blackrock/Blackrock embrac/Embraces rwa/Rwa token/Tokenization gamechang/Gamechanger viridi/Viridis network/Network
Latest data on the carbon footprint of solar energy,1,latest/Latest data/Data carbon/Carbon footprint/Footprint solar/Solar energi/Energy
The Cost and Carbon benefit of a Heat Pump: a real-world analysis,1,cost/Cost carbon/Carbon benefit/Benefit heat/Heat pump/Pump realworld/Realworld analysi/Analysis
Sustainable AI: 3 tools to measure the environmental impact of ML solutions,1,sustain/Sustainable ai/Ai tool/Tools measur/Measure environment/Environmental impact/Impact ml/Ml solut/Solutions
How Decarbonization Helps in Climate Stability?,1,decarbon/Decarbonization help/Helps climat/Climate stabil/Stability
Carbon Footprint: Why Common Claims May Not Be Accurate,1,carbon/Carbon footprint/Footprint common/Common claim/Claims may/May accur/Accurate
Building an AWS EC2 Carbon Emissions Dataset,1,build/Building aw/Aws ec2/Ec2 carbon/Carbon emiss/Emissions dataset/Dataset
The BLOOH SYSTEM: Navigating Emissions Reporting with a Cost-Effective Twist,1,blooh/Blooh system/System navig/Navigating emiss/Emissions report/Reporting costeffect/Costeffective twist/Twist
How Auto-Switching Companies Monitor Government Carbon Pricing Policies To Lower Energy Bills,1,autoswitch/Autoswitching compani/Companies monitor/Monitor govern/Government carbon/Carbon price/Pricing polici/Policies lower/Lower energi/Energy bill/Bills
Why a carbon tax cannot be the only solution to climate change,1,carbon/Carbon tax/Tax solut/Solution climat/Climate chang/Change
Combating Mindanao's Environmental and Societal Challenges through Carbon Taxing,1,combat/Combating mindanao/Mindanaos environment/Environmental societ/Societal challeng/Challenges carbon/Carbon tax/Taxing
Would a Carbon Tax Really Hurt the Poor?,1,would/Would carbon/Carbon tax/Tax realli/Really hurt/Hurt poor/Poor
The EU’s Carbon Border Adjustment Mechanism (CBAM) and Decarbonization,1,eu/Eus carbon/Carbon border/Border adjust/Adjustment mechan/Mechanism cbam/Cbam decarbon/Decarbonization
Does Canada have it right on their Carbon Tax,1,canada/Canada right/Right carbon/Carbon tax/Tax
Carbon Pricing Instruments: An Overview of the Carbon Tax and Cap and Trade System,1,carbon/Carbon price/Pricing instrument/Instruments overview/Overview carbon/Carbon tax/Tax cap/Cap trade/Trade system/System
Hate the Carbon Tax? You Might Not Know What’s Really Going On…,1,hate/Hate carbon/Carbon tax/Tax might/Might know/Know what/Whats realli/Really go/Going
Inefficiencies of Cap and Trade,1,ineffici/Inefficiencies cap/Cap trade/Trade
CAP AND WAIT,1,cap/Cap wait/Wait
A Key Player in Environmental Economics: Navigating the Cap and Trade System,1,key/Key player/Player environment/Environmental econom/Economics navig/Navigating cap/Cap trade/Trade system/System
Carbon what?,1,carbon/Carbon
What has cap-and-trade done for us lately?,1,capandtrad/Capandtrade done/Done us/Us late/Lately
Carbon Tax vs. Cap-and-Trade: Which is Better and Why?,1,carbon/Carbon tax/Tax vs/Vs capandtrad/Capandtrade better/Better
Intro to Jasmine — A decentralized market for climate assets,1,intro/Intro jasmin/Jasmine decentr/Decentralized market/Market climat/Climate asset/Assets
Is “Climate Action” just a scam to get you to pay for someone else’s carbon emissions?,1,climat/Climate action/Action scam/Scam get/Get pay/Pay someon/Someone els/Elses carbon/Carbon emiss/Emissions
CarbonKerma: An Antidote to Greenwashing,1,carbonkerma/Carbonkerma antidot/Antidote greenwash/Greenwashing
The EU’s Carbon Tariff: An Overview and Implications,1,eu/Eus carbon/Carbon tariff/Tariff overview/Overview implic/Implications
The Role of Emission Factors and GWP in Carbon Accounting,1,role/Role emiss/Emission factor/Factors gwp/Gwp carbon/Carbon account/Accounting
PERL.ECO COMMUNITY UPDATE,1,perleco/Perleco commun/Community updat/Update
Are you ready to join the revolution of carbon emissions trading?,1,readi/Ready join/Join revolut/Revolution carbon/Carbon emiss/Emissions trade/Trading
Carbon as an asset class,1,carbon/Carbon asset/Asset class/Class
Developing India’s Carbon Market,1,develop/Developing india/Indias carbon/Carbon market/Market
Climate Financing Vol. I,1,climat/Climate financ/Financing vol/Vol
European Parliament Shuts Down Climate Bill Amidst Chaos,1,european/European parliament/Parliament shut/Shuts climat/Climate bill/Bill amidst/Amidst chao/Chaos
Owning up to carbon: Why mandatory climate disclosure requirements could drive demand for emission…,1,own/Owning carbon/Carbon mandatori/Mandatory climat/Climate disclosur/Disclosure requir/Requirements could/Could drive/Drive demand/Demand emiss/Emission
About Gaja,1,gaja/Gaja
Climate Budgeting and the Art of De-siloing City Governance,1,climat/Climate budget/Budgeting art/Art desilo/Desiloing citi/City govern/Governance
A breakdown of FY22 funding for carbon removal,1,breakdown/Breakdown fy22/Fy22 fund/Funding carbon/Carbon remov/Removal
Why Toniic members invested with Overture VC (Part 1/2) — Overture Fund I,1,toniic/Toniic member/Members invest/Invested overtur/Overture vc/Vc part/Part overtur/Overture fund/Fund
Leveraging forests for a just transition,1,leverag/Leveraging forest/Forests transit/Transition
Want to Accelerate Climate Action? Show People Real-Life Benefits,1,want/Want acceler/Accelerate climat/Climate action/Action show/Show peopl/People reallif/Reallife benefit/Benefits
The IRA funding that’s boosting carbon removal,1,ira/Ira fund/Funding that/Thats boost/Boosting carbon/Carbon remov/Removal
Issue 114: Biodiversity,1,issu/Issue biodivers/Biodiversity
Johan Rockström’s 10-point agenda for saving the world (unofficial transcript),1,johan/Johan rockstrm/Rockstrms 10point/10Point agenda/Agenda save/Saving world/World unoffici/Unofficial transcript/Transcript
The Climate Crisis seen from Davos,1,climat/Climate crisi/Crisis seen/Seen davo/Davos
Daybreak: A Cooperative Board Game for Climate Action Education,1,daybreak/Daybreak cooper/Cooperative board/Board game/Game climat/Climate action/Action educ/Education
Over 80% of global carbon emissions came from just 57 producers,1,global/Global carbon/Carbon emiss/Emissions came/Came produc/Producers
5 Reasons Why the Paris Agreement is a Joke (and How We Can Fix It),1,reason/Reasons pari/Paris agreement/Agreement joke/Joke fix/Fix
WHAT IS CLIMATE FINANCE AND WHY DO WE NEED MORE OF IT?,1,climat/Climate financ/Finance need/Need
IPCC: a site for innovation in its own right?,1,ipcc/Ipcc site/Site innov/Innovation right/Right
How much would a 100% nuclear energy system cost?,1,much/Much would/Would nuclear/Nuclear energi/Energy system/System cost/Cost
Why Carbon? Compliance Market History,1,carbon/Carbon complianc/Compliance market/Market histori/History
Top 10 tourist attractions to visit in Paris,1,top/Top tourist/Tourist attract/Attractions visit/Visit pari/Paris
Can We Reach Net-Zero By 2050?,1,reach/Reach netzero/Netzero
What are the NDCs and why are they important?,1,ndc/Ndcs import/Important
The Story of KYOTO: Revolutionizing Carbon Credits with the World’s Most Sustainable Blockchain,1,stori/Story kyoto/Kyoto revolution/Revolutionizing carbon/Carbon credit/Credits world/Worlds sustain/Sustainable blockchain/Blockchain
"How we can use economics to solve climate change, globally.",1,use/Use econom/Economics solv/Solve climat/Climate chang/Change global/Globally
Unlock Rewards and Join the Kyoto Protocol Waiting List Competition for a Chance to Win Big!,1,unlock/Unlock reward/Rewards join/Join kyoto/Kyoto protocol/Protocol wait/Waiting list/List competit/Competition chanc/Chance win/Win big/Big
Clean Development Mechanism(CDM)-,1,clean/Clean develop/Development mechanismcdm/Mechanismcdm
Can ozone hole solve the climate crisis?,1,ozon/Ozone hole/Hole solv/Solve climat/Climate crisi/Crisis
KyotoProtocol AMA Recap Crypto Revolution Masters Community,1,kyotoprotocol/Kyotoprotocol ama/Ama recap/Recap crypto/Crypto revolut/Revolution master/Masters commun/Community
Remember the Kyoto Protocol?,1,rememb/Remember kyoto/Kyoto protocol/Protocol
Cudos Partnered with KyotoProtocol to achieve Carbon Neutrality,1,cudo/Cudos partner/Partnered kyotoprotocol/Kyotoprotocol achiev/Achieve carbon/Carbon neutral/Neutrality
Cudos and KyotoProtocol.io enter carbon offsetting partnership,1,cudo/Cudos kyotoprotocolio/Kyotoprotocolio enter/Enter carbon/Carbon offset/Offsetting partnership/Partnership
Climate Change — the Wicked Problem — Musings by Celine 🌿,1,climat/Climate chang/Change wick/Wicked problem/Problem muse/Musings celin/Celine
"Don’t plant trees. Wait, what now?",1,dont/Dont plant/Plant tree/Trees wait/Wait
Cultivating Corporate Sustainability: Biodiversity Conservation and CSR,1,cultiv/Cultivating corpor/Corporate sustain/Sustainability biodivers/Biodiversity conserv/Conservation csr/Csr
Create Your Own Microforest,1,creat/Create microforest/Microforest
AGRICULTURE PROJECT TOPICS AND MATERIALS,1,agricultur/Agriculture project/Project topic/Topics materi/Materials
"AFFORESTATION AND ITS POSITIVE ENVIRONMENTAL IMPACT
I am delighted to write to you about…",1,afforest/Afforestation posit/Positive environment/Environmental impact/Impact delight/Delighted write/Write
The Realities of Reforestation,1,realiti/Realities reforest/Reforestation
Indian forest man Jadav Payeng,1,indian/Indian forest/Forest man/Man jadav/Jadav payeng/Payeng
Youth-led Organization as the Future for Addressing SDGs in Local Communities: A Case Study of…,1,youthl/Youthled organ/Organization futur/Future address/Addressing sdg/Sdgs local/Local commun/Communities case/Case studi/Study
"Empowering Youth: Addressing SDGs 1, 13, and 17 through Afforestation and Tree Monitoring in Local…",1,empow/Empowering youth/Youth address/Addressing sdg/Sdgs afforest/Afforestation tree/Tree monitor/Monitoring local/Local
Promoting Sustainability of Afforestation Campaigns through Open Mapping Tools to Enhance…,1,promot/Promoting sustain/Sustainability afforest/Afforestation campaign/Campaigns open/Open map/Mapping tool/Tools enhanc/Enhance
CARBIFY CO2 POOLS. REAL YIELD GENERATED BY REAL-WORLD ASSETS.,1,carbifi/Carbify co2/Co2 pool/Pools real/Real yield/Yield gener/Generated realworld/Realworld asset/Assets
Missing the Ecosystems for the Trees,1,miss/Missing ecosystem/Ecosystems tree/Trees
"Heal the Earth, Heal Ourselves",1,heal/Heal earth/Earth heal/Heal
Finding the Right Balance: How Remote is Right for Off-Grid Living and Homesteading in a New…,1,find/Finding right/Right balanc/Balance remot/Remote right/Right offgrid/Offgrid live/Living homestead/Homesteading new/New
AAREY FOREST CASE (Case Study),1,aarey/Aarey forest/Forest case/Case studi/Study
Sustainability and Finance: Moolamore’s Contribution to Green Initiatives,1,sustain/Sustainability financ/Finance moolamor/Moolamores contribut/Contribution green/Green initi/Initiatives
Introducing Silvi — The Tree Steward Platform,1,introduc/Introducing silvi/Silvi tree/Tree steward/Steward platform/Platform
Innovating the Future: Mass Tree Planting Solutions for Global Warming through Desert Greening and…,1,innov/Innovating futur/Future mass/Mass tree/Tree plant/Planting solut/Solutions global/Global warm/Warming desert/Desert green/Greening
Trovador: Tree Planting Robot,1,trovador/Trovador tree/Tree plant/Planting robot/Robot
Restoration of Eden: The Way to Total Reforestation of Tropical Forests,1,restor/Restoration eden/Eden way/Way total/Total reforest/Reforestation tropic/Tropical forest/Forests
"Climate Change, Solved",1,climat/Climate chang/Change solv/Solved
Unlocking Carbon Credits Through Agricultural Practices,1,unlock/Unlocking carbon/Carbon credit/Credits agricultur/Agricultural practic/Practices
What if we Think in Carbon Cycles rather than carbon storage?,1,think/Think carbon/Carbon cycl/Cycles rather/Rather carbon/Carbon storag/Storage
How many trees would we need to plant to stop global warming?,1,mani/Many tree/Trees would/Would need/Need plant/Plant stop/Stop global/Global warm/Warming
Why Hemp?,1,hemp/Hemp
agribazaar’s Role in Advancing Carbon Sequestration Efforts in India!,1,agribazaar/Agribazaars role/Role advanc/Advancing carbon/Carbon sequestr/Sequestration effort/Efforts india/India
Gigablue: Phytoplankton-based carbon sequestraio,1,gigablu/Gigablue phytoplanktonbas/Phytoplanktonbased carbon/Carbon sequestraio/Sequestraio
The path to a green economy cannot wish away fossil fuels for the foreseeable future,1,path/Path green/Green economi/Economy wish/Wish away/Away fossil/Fossil fuel/Fuels forese/Foreseeable futur/Future
"Sustainable Development Blueprint: Harnessing Lipa, Batangas’s Geological Potential for Renewable…",1,sustain/Sustainable develop/Development blueprint/Blueprint har/Harnessing lipa/Lipa batangass/Batangass geolog/Geological potenti/Potential renew/Renewable
The Rise of Green Bonds: Financing a Sustainable Future,1,rise/Rise green/Green bond/Bonds financ/Financing sustain/Sustainable futur/Future
Rising Waters: Decoding Yonkers’ Flood Crisis,1,rise/Rising water/Waters decod/Decoding yonker/Yonkers flood/Flood crisi/Crisis
A swimable creek,1,swimabl/Swimable creek/Creek
Trees As Infrastructure,1,tree/Trees infrastructur/Infrastructure
Is Yonkers Future Green?,1,yonker/Yonkers futur/Future green/Green
Looking at Cooling Benefits of Plants Through NYC Vegetation Data,1,look/Looking cool/Cooling benefit/Benefits plant/Plants nyc/Nyc veget/Vegetation data/Data
"Water, Water Everywhere: Soaking Up Our Most Precious Resource",1,water/Water everywher/Everywhere soak/Soaking preciou/Precious resourc/Resource
The Future of Stormwater Management: Emerging Trends,1,futur/Future stormwat/Stormwater manag/Management emerg/Emerging trend/Trends
Sustainable Urban Development: Building Resilient Cities,1,sustain/Sustainable urban/Urban develop/Development build/Building resili/Resilient citi/Cities
The Genius Design of Thammasat University Rooftop Garden: Case Study,1,geniu/Genius design/Design thammasat/Thammasat univers/University rooftop/Rooftop garden/Garden case/Case studi/Study
So Fast They Can’t Hear You,1,fast/Fast cant/Cant hear/Hear
The artistic flair inspiring greener European cities,1,artist/Artistic flair/Flair inspir/Inspiring greener/Greener european/European citi/Cities
Urban Greening with Tech: Transforming Cities into Sustainable Ecosystems,1,urban/Urban green/Greening tech/Tech transform/Transforming citi/Cities sustain/Sustainable ecosystem/Ecosystems
Guaranteed Income and the Case for a Solidarity & Care Economy,1,guarante/Guaranteed incom/Income case/Case solidar/Solidarity care/Care economi/Economy
"Neighbourhood green space is in rapid decline, deepening both the climate and mental health crises",1,neighbourhood/Neighbourhood green/Green space/Space rapid/Rapid declin/Decline deepen/Deepening climat/Climate mental/Mental health/Health crise/Crises
"8-Story Apartments Could Come to One of SF’s Quaintest Neighborhoods, Thanks in Part to BART",1,8stori/8Story apart/Apartments could/Could come/Come one/One sf/Sfs quaintest/Quaintest neighborhood/Neighborhoods thank/Thanks part/Part bart/Bart
Youth-Led City Building: Thriving at 1UP Conference 2024,1,youthl/Youthled citi/City build/Building thrive/Thriving 1up/1Up confer/Conference
Why is Socialist Housing so Ugly,1,socialist/Socialist hous/Housing ugli/Ugly
Let’s Talk About Mud Flood,1,let/Lets talk/Talk mud/Mud flood/Flood
A Portuguese Heritage District: A Proposal for New Bedford,1,portugues/Portuguese heritag/Heritage district/District propos/Proposal new/New bedford/Bedford
