title,topic,title_combined
"Love notes to my dear, dark Guatemalan…",0,love/Love note/Notes dear/Dear dark/Dark guatemalan/Guatemalan
I Quit Caffeine for a Month and Here’s What It Did to My Life,0,quit/Quit caffein/Caffeine month/Month here/Heres life/Life
Your Guide to Guilt-Free Coffee,0,guid/Guide guiltfre/Guiltfree coffe/Coffee
Revolutionize Your Morning Routine: The Cardiologist’s Coffee Hack You Need to Try Now,0,revolution/Revolutionize morn/Morning routin/Routine cardiologist/Cardiologists coffe/Coffee hack/Hack need/Need tri/Try
Why do we sleep?,0,sleep/Sleep
The Reasons I Bake Even When I’m Surrounded by Bakeries,0,reason/Reasons bake/Bake even/Even im/Im surround/Surrounded bakeri/Bakeries
I made the best bread in Mexico,0,made/Made best/Best bread/Bread mexico/Mexico
Delectable Cinnamon Buns,0,delect/Delectable cinnamon/Cinnamon bun/Buns
What breakfast pie can tell you about Gestalt psychology,0,breakfast/Breakfast pie/Pie tell/Tell gestalt/Gestalt psycholog/Psychology
It Took Me Years to Master the Family Sugar Cookie Recipe,0,took/Took year/Years master/Master famili/Family sugar/Sugar cooki/Cookie recip/Recipe
Is it Safe to Take Tylenol and Allergy Medicine at the Same Time?,0,safe/Safe take/Take tylenol/Tylenol allergi/Allergy medicin/Medicine time/Time
How Does This Witch Look at Things?,0,witch/Witch look/Look thing/Things
"Leavening Dough, Fast and Slow",0,leaven/Leavening dough/Dough fast/Fast slow/Slow
Do You Want to Join My Bread Baking Club?,0,want/Want join/Join bread/Bread bake/Baking club/Club
Secrets to establishing a commercial Bakery,0,secret/Secrets establish/Establishing commerci/Commercial bakeri/Bakery
What Everyone Should Know Before Buying Pellet Smokers,0,everyon/Everyone know/Know buy/Buying pellet/Pellet smoker/Smokers
The Ultimate Guide to Crafting Perfect Pork Ribs: Elevate Your BBQ Game,0,ultim/Ultimate guid/Guide craft/Crafting perfect/Perfect pork/Pork rib/Ribs elev/Elevate bbq/Bbq game/Game
Why We Advise AGAINST Buying a Tomahawk Steak,0,advis/Advise buy/Buying tomahawk/Tomahawk steak/Steak
"My Heart Says Salad, But My Taste Buds Say Wagyu",0,heart/Heart say/Says salad/Salad tast/Taste bud/Buds say/Say wagyu/Wagyu
Coconut Shell Charcoal Briquette vs.,0,coconut/Coconut shell/Shell charcoal/Charcoal briquett/Briquette vs/Vs
The Best Outdoor Grills for Summer BBQ Parties,0,best/Best outdoor/Outdoor grill/Grills summer/Summer bbq/Bbq parti/Parties
A beginner’s guide to Kamado cooking (Big Egg-style) on a budget,0,beginn/Beginners guid/Guide kamado/Kamado cook/Cooking big/Big eggstyl/Eggstyle budget/Budget
Review of the Best Outdoor Grills for BBQ Enthusiasts,0,review/Review best/Best outdoor/Outdoor grill/Grills bbq/Bbq enthusiast/Enthusiasts
No Yard? No Problem: Top 5 Pellet Grills for Compact Spaces,0,yard/Yard problem/Problem top/Top pellet/Pellet grill/Grills compact/Compact space/Spaces
RECIPE — How On Earth Did You Manage To Mess Up Grilling Fruit And Vegetables?,0,recip/Recipe earth/Earth manag/Manage mess/Mess grill/Grilling fruit/Fruit veget/Vegetables
What Will You Be Drinking Tonight?,0,drink/Drinking tonight/Tonight
I Hired a 50-Year-Old Waiter After Asking Him Exactly One Question,0,hire/Hired 50yearold/50Yearold waiter/Waiter ask/Asking exactli/Exactly one/One question/Question
Our Phenomenal Perception Elevator,0,phenomen/Phenomenal percept/Perception elev/Elevator
Hospitality Is an Incredibly Skilled Career Choice and I Dare You to Disagree,0,hospit/Hospitality incred/Incredibly skill/Skilled career/Career choic/Choice dare/Dare disagre/Disagree
"As a Sommelier, If I Could Only Drink Three Grape Varieties for the Rest of My Life, It Would Be…",0,sommeli/Sommelier could/Could drink/Drink three/Three grape/Grape varieti/Varieties rest/Rest life/Life would/Would
"If You Mostly Drink Full-Bodied Red Wines You’re Not Alone, But You Are Missing Out",0,mostli/Mostly drink/Drink fullbodi/Fullbodied red/Red wine/Wines your/Youre alon/Alone miss/Missing
Eric Burdon’s Baffling ‘Spill the Wine’ Explained,0,eric/Eric burdon/Burdons baffl/Baffling spill/Spill wine/Wine explain/Explained
Is A Glass of Wine Per Day Healthy for Your Heart?,0,glass/Glass wine/Wine per/Per day/Day healthi/Healthy heart/Heart
Repeat After Me: You Can Drink Any Style of Wine Regardless of Your Gender,0,repeat/Repeat drink/Drink style/Style wine/Wine regardless/Regardless gender/Gender
How To Brew a Delicious British Golden Ale,0,brew/Brew delici/Delicious british/British golden/Golden ale/Ale
My Quest for Holy Beer in Japan,0,quest/Quest holi/Holy beer/Beer japan/Japan
How To Brew a Perfectly Balanced English IPA,0,brew/Brew perfectli/Perfectly balanc/Balanced english/English ipa/Ipa
Why I Started a Soccer Supporter Group,0,start/Started soccer/Soccer support/Supporter group/Group
Triple Bottom Brewing,0,tripl/Triple bottom/Bottom brew/Brewing
Can Beer Get Warm and Then Cold Again?,0,beer/Beer get/Get warm/Warm cold/Cold
"Dogfish Head’s Sam Calagione On Drinks, Delaware & Record Store Day 2024 — “Paltrocast” Exclusive",0,dogfish/Dogfish head/Heads sam/Sam calagion/Calagione drink/Drinks delawar/Delaware record/Record store/Store day/Day paltrocast/Paltrocast exclus/Exclusive
Review: Go Brewing,0,review/Review go/Go brew/Brewing
🍺 Barcelona Beer Festival….and a recipe! 🍺,0,barcelona/Barcelona beer/Beer festivaland/Festivaland recip/Recipe
Are there any health or safety risks involved in drinking homemade beer?,0,health/Health safeti/Safety risk/Risks involv/Involved drink/Drinking homemad/Homemade beer/Beer
Baiting Pressure — A Brighton Thing?,0,bait/Baiting pressur/Pressure brighton/Brighton thing/Thing
Part 3: Using Rondos as a Framework in Training,0,part/Part use/Using rondo/Rondos framework/Framework train/Training
"I Read “If I Did It,” The Hypothetical Confession Of OJ Simpson, So You Don’t Have To: A Book…",0,read/Read hypothet/Hypothetical confess/Confession oj/Oj simpson/Simpson dont/Dont book/Book
Karim Benzema: From Understudy to Undisputed King at Real Madrid,0,karim/Karim benzema/Benzema understudi/Understudy undisput/Undisputed king/King real/Real madrid/Madrid
Boot Ball,0,boot/Boot ball/Ball
QPR Recruitment Focus: Goalkeepers,0,qpr/Qpr recruit/Recruitment focu/Focus goalkeep/Goalkeepers
Aloha Stadium — Farewell to Its Past,0,aloha/Aloha stadium/Stadium farewel/Farewell past/Past
Breaking My Foot Helped Me Overcome My Fear of Speaking,0,break/Breaking foot/Foot help/Helped overcom/Overcome fear/Fear speak/Speaking
Top 5 of the Most Watched Football Leagues in the World today!,0,top/Top watch/Watched footbal/Football leagu/Leagues world/World today/Today
Hero or Murderer?,0,hero/Hero murder/Murderer
Free Chicken Sandwiches…Thanks to Boban Marjanovic!,0,free/Free chicken/Chicken sandwichesthank/Sandwichesthanks boban/Boban marjanov/Marjanovic
Running For Our Lives in Boston,0,run/Running live/Lives boston/Boston
My Life Changed After My Dad Saw Me Play Basketball for 1.9 Seconds,0,life/Life chang/Changed dad/Dad saw/Saw play/Play basketbal/Basketball second/Seconds
I Met a Hall of Fame NBA Coach in a Dark Alley,0,met/Met hall/Hall fame/Fame nba/Nba coach/Coach dark/Dark alley/Alley
"In 49 States, It’s Just Basketball",0,state/States basketbal/Basketball
Feature Engineering with Microsoft Fabric and PySpark,0,featur/Feature engin/Engineering microsoft/Microsoft fabric/Fabric pyspark/Pyspark
What It’s Like to Lose A Basketball Game by 100 Points,0,like/Like lose/Lose basketbal/Basketball game/Game point/Points
The Humbling Effects of Caitlin Clark’s Dominance,0,humbl/Humbling effect/Effects caitlin/Caitlin clark/Clarks domin/Dominance
10 Universal Life Lessons from 20 Years of Coaching and Playing Basketball,0,univers/Universal life/Life lesson/Lessons year/Years coach/Coaching play/Playing basketbal/Basketball
College Hoops on the Brink: How Power Six’s Non-Conference Scheduling Exposes a Crisis of…,0,colleg/College hoop/Hoops brink/Brink power/Power six/Sixs nonconfer/Nonconference schedul/Scheduling expos/Exposes crisi/Crisis
Mariners Recall Outfielder Jonatan Clase from Triple-A Tacoma,0,marin/Mariners recal/Recall outfield/Outfielder jonatan/Jonatan clase/Clase triplea/Triplea tacoma/Tacoma
Arrows in the Quiver: Classifying Pitches by Role,0,arrow/Arrows quiver/Quiver classifi/Classifying pitch/Pitches role/Role
Life Lessons and Laughing in an Elevator with Tony Gwynn,0,life/Life lesson/Lessons laugh/Laughing elev/Elevator toni/Tony gwynn/Gwynn
"PIONEERS, Season Two: David Block",0,pioneer/Pioneers season/Season two/Two david/David block/Block
Leading My High School Baseball Team from Worst to First,0,lead/Leading high/High school/School basebal/Baseball team/Team worst/Worst first/First
"Best 101+ Baseball Pick Up lines | [Funny, Dirty, Cheesy]",0,best/Best basebal/Baseball pick/Pick line/Lines funni/Funny dirti/Dirty cheesi/Cheesy
Don’t Take Me Out To The Ball Game,0,dont/Dont take/Take ball/Ball game/Game
A Testament to America’s Favorite Pastime,0,testament/Testament america/Americas favorit/Favorite pastim/Pastime
"PIONEERS, Season Two: Bill James",0,pioneer/Pioneers season/Season two/Two bill/Bill jame/James
An Open Letter to the Oakland Coliseum,0,open/Open letter/Letter oakland/Oakland coliseum/Coliseum
Nobody Wants To Host The Olympics Anymore,0,nobodi/Nobody want/Wants host/Host olymp/Olympics anymor/Anymore
A Final Look at the Orlando Weather for the US Olympic Team Trials,0,final/Final look/Look orlando/Orlando weather/Weather us/Us olymp/Olympic team/Team trial/Trials
Will My Vagina Show?,0,vagina/Vagina show/Show
The Future of Asian Footballers in Qatar,0,futur/Future asian/Asian footbal/Footballers qatar/Qatar
Understanding the Road to the Paris Olympic Marathon,0,understand/Understanding road/Road pari/Paris olymp/Olympic marathon/Marathon
Olympic Hospitality House List for Paris Summer Games — Ultimate Guide to Paris 2024,0,olymp/Olympic hospit/Hospitality hous/House list/List pari/Paris summer/Summer game/Games ultim/Ultimate guid/Guide pari/Paris
Gold Meets Golden: Uniting Athletes and Hollywood for Angel City Sports,0,gold/Gold meet/Meets golden/Golden unit/Uniting athlet/Athletes hollywood/Hollywood angel/Angel citi/City sport/Sports
Will the Heat Reduce Times at the US Olympic Trials Marathon?,0,heat/Heat reduc/Reduce time/Times us/Us olymp/Olympic trial/Trials marathon/Marathon
"Ladies, Don’t Run! Your Womb May Fall Out",0,ladi/Ladies dont/Dont run/Run womb/Womb may/May fall/Fall
Why Wasn’t Heat an Issue at the 2020 US Olympic Trials Marathon?,0,wasnt/Wasnt heat/Heat issu/Issue us/Us olymp/Olympic trial/Trials marathon/Marathon
Nike Tiempo Emerald: 30 Years of Premium Touch,0,nike/Nike tiempo/Tiempo emerald/Emerald year/Years premium/Premium touch/Touch
From Breakup to Breakthrough — Soccer’s Role in My Divorce Recovery,0,breakup/Breakup breakthrough/Breakthrough soccer/Soccers role/Role divorc/Divorce recoveri/Recovery
Why a Sports Stadium Built for Women Matters,0,sport/Sports stadium/Stadium built/Built women/Women matter/Matters
Don’t Kill the Love of the Game for Young Referees,0,dont/Dont kill/Kill love/Love game/Game young/Young refere/Referees
The Genius And Brilliance Of Carlos Corberán,0,geniu/Genius brillianc/Brilliance carlo/Carlos corbern/Corbern
Vini Jr.: The Explosive Winger Taking Flight at Real Madrid,0,vini/Vini jr/Jr explos/Explosive winger/Winger take/Taking flight/Flight real/Real madrid/Madrid
Will Aryna Sabalenka Be Victorious at the 2024 WTA Stuttgart Open? Destiny Awaits.,0,aryna/Aryna sabalenka/Sabalenka victori/Victorious wta/Wta stuttgart/Stuttgart open/Open destini/Destiny await/Awaits
Going One Better than Sampras,0,go/Going one/One better/Better sampra/Sampras
John McEnroe: Tempestuous Tennis Prodigy,0,john/John mcenro/Mcenroe tempestu/Tempestuous tenni/Tennis prodigi/Prodigy
"Holger Rune, Monster Mentality, and Positive Body Language  —  A Blooming Relationship At Last",0,holger/Holger rune/Rune monster/Monster mental/Mentality posit/Positive bodi/Body languag/Language bloom/Blooming relationship/Relationship last/Last
From Seven in a Row at Wimbledon…to Six Wins on the Trot In Miami,0,seven/Seven row/Row wimbledonto/Wimbledonto six/Six win/Wins trot/Trot miami/Miami
Tennis analysis using deep learning and machine learning.,0,tenni/Tennis analysi/Analysis use/Using deep/Deep learn/Learning machin/Machine learn/Learning
Mastering the Game: On And Off The Tennis Court,0,master/Mastering game/Game tenni/Tennis court/Court
Everything You Need to Know to Captain a Tennis Team…,0,everyth/Everything need/Need know/Know captain/Captain tenni/Tennis team/Team
Watch Zendaya Smash Expectations in her Scandalous New Role in ‘Challengers’!,0,watch/Watch zendaya/Zendaya smash/Smash expect/Expectations scandal/Scandalous new/New role/Role challeng/Challengers
Tsitsipas Triumphs: A Monaco Masterclass,0,tsitsipa/Tsitsipas triumph/Triumphs monaco/Monaco masterclass/Masterclass
"Ultimate Guide to Choosing the Best Home Golf Simulator in 2024: Reviews, Setup & FAQs",0,ultim/Ultimate guid/Guide choos/Choosing best/Best home/Home golf/Golf simul/Simulator review/Reviews setup/Setup faq/Faqs
My first hole-in-one: the true story of how I once hit a golf ball 84 yards at Scholl Canyon and…,0,first/First holeinon/Holeinone true/True stori/Story hit/Hit golf/Golf ball/Ball yard/Yards scholl/Scholl canyon/Canyon
How to Join Augusta National Golf Club,0,join/Join augusta/Augusta nation/National golf/Golf club/Club
I Rooted for the Wrong Golfer at The Masters,0,root/Rooted wrong/Wrong golfer/Golfer master/Masters
I Can’t Golf — Or Quit,0,cant/Cant golf/Golf quit/Quit
Most Disliked Players On Pga Tour,0,dislik/Disliked player/Players pga/Pga tour/Tour
The Best Golf Simulators For Home Options For 2024,0,best/Best golf/Golf simul/Simulators home/Home option/Options
Sign Me up for the Senior’s Tour,0,sign/Sign senior/Seniors tour/Tour
Tanka of the Meaning of Life,0,tanka/Tanka mean/Meaning life/Life
Scottie scheffler the king of golf,0,scotti/Scottie scheffler/Scheffler king/King golf/Golf
The Making of Champions,0,make/Making champion/Champions
Heather Hardy Doesn’t Back Down from Any Fight,0,heather/Heather hardi/Hardy doesnt/Doesnt back/Back fight/Fight
The Tragedy of Prichard Colón,0,tragedi/Tragedy prichard/Prichard coln/Coln
Day 7: The Importance of Recovery and Self-Care,0,day/Day import/Importance recoveri/Recovery selfcar/Selfcare
The Counter Puncher,0,counter/Counter puncher/Puncher
THE 100 GREATEST BOXERS OF ALL-TIME: THE FULL LIST,0,greatest/Greatest boxer/Boxers alltim/Alltime full/Full list/List
A Few Thoughts on Kenjitsu,0,thought/Thoughts kenjitsu/Kenjitsu
Equal Rights to Equal Lefts? Claressa Shields Challenges Keith Thurman to Boxing Brawl,0,equal/Equal right/Rights equal/Equal left/Lefts claressa/Claressa shield/Shields challeng/Challenges keith/Keith thurman/Thurman box/Boxing brawl/Brawl
The Little-Known Story of a Boston Man Who Revolutionized the Sport of Boxing,0,littleknown/Littleknown stori/Story boston/Boston man/Man revolution/Revolutionized sport/Sport box/Boxing
The Unshakeable Legacy of Fedor Emelianenko: The Undeniable Greatest MMA Heavyweight of All Time,0,unshak/Unshakeable legaci/Legacy fedor/Fedor emelianenko/Emelianenko undeni/Undeniable greatest/Greatest mma/Mma heavyweight/Heavyweight time/Time
Lost in Kronenwetter: Boring bicycle adventures in Northcentral Wisconsin,0,lost/Lost kronenwett/Kronenwetter bore/Boring bicycl/Bicycle adventur/Adventures northcentr/Northcentral wisconsin/Wisconsin
Beginner Ironman Training: A Minimalist Approach | The Bike (Part 1),0,beginn/Beginner ironman/Ironman train/Training minimalist/Minimalist approach/Approach bike/Bike part/Part
"Connect Your Apple Watch to a Garmin Edge, Wahoo ELEMNT, or any other BLE Bike Computer",0,connect/Connect appl/Apple watch/Watch garmin/Garmin edg/Edge wahoo/Wahoo elemnt/Elemnt ble/Ble bike/Bike comput/Computer
On Meeting a Hermit on Top of a Mountain Peak,0,meet/Meeting hermit/Hermit top/Top mountain/Mountain peak/Peak
Beginner Ironman Training: A Minimalist Approach | The Bike (Part 3),0,beginn/Beginner ironman/Ironman train/Training minimalist/Minimalist approach/Approach bike/Bike part/Part
Understanding the Crucial Role of Cardiovascular Fitness and How to Improve It,0,understand/Understanding crucial/Crucial role/Role cardiovascular/Cardiovascular fit/Fitness improv/Improve
A Guy Goes Into A Bar,0,guy/Guy goe/Goes bar/Bar
How To Connect Your Apple Watch to Wahoo ELEMNT Bike Computers as a Heart Rate Sensor,0,connect/Connect appl/Apple watch/Watch wahoo/Wahoo elemnt/Elemnt bike/Bike comput/Computers heart/Heart rate/Rate sensor/Sensor
Learning to ride a bicycle at the ripe old age of 35,0,learn/Learning ride/Ride bicycl/Bicycle ripe/Ripe old/Old age/Age
A Front Row Seat for the Growth of Women’s Bike Racing,0,front/Front row/Row seat/Seat growth/Growth women/Womens bike/Bike race/Racing
Root to Rise Retreat,0,root/Root rise/Rise retreat/Retreat
What a Year of Inclusion Practices Taught Me,0,year/Year inclus/Inclusion practic/Practices taught/Taught
An honest review of ClassPass: is ClassPass worth it in 2023?,0,honest/Honest review/Review classpass/Classpass worth/Worth
"At 8 years old, I started Hating my Body. This is what Helped Me.",0,year/Years old/Old start/Started hate/Hating bodi/Body help/Helped
Softening the Harsh Memories of My Daughter’s Death,0,soften/Softening harsh/Harsh memori/Memories daughter/Daughters death/Death
I Performed Daily Yoga Asanas for 365 Days — The Results Blew Me Away,0,perform/Performed daili/Daily yoga/Yoga asana/Asanas day/Days result/Results blew/Blew away/Away
Unraveling the Mysteries: The Origin of Yoga,0,unravel/Unraveling mysteri/Mysteries origin/Origin yoga/Yoga
Confessions From A Meditation Failure,0,confess/Confessions medit/Meditation failur/Failure
Yoga and Contemplation in the Serenity of Parks,0,yoga/Yoga contempl/Contemplation seren/Serenity park/Parks
To Engage is to Empower: A Power Yoga Theme,0,engag/Engage empow/Empower power/Power yoga/Yoga theme/Theme
Laziness: Lessons From the Ashtavakra Gita and a Viral Medium Article,0,lazi/Laziness lesson/Lessons ashtavakra/Ashtavakra gita/Gita viral/Viral medium/Medium articl/Article
Mindful or Full Mind?,0,mind/Mindful full/Full mind/Mind
Are You Experiencing These Physical Symptoms After The Eclipse?,0,experienc/Experiencing physic/Physical symptom/Symptoms eclips/Eclipse
Is being controlling ruining your relationships?,0,control/Controlling ruin/Ruining relationship/Relationships
Does it Matter What YOU Think?,0,matter/Matter think/Think
"10 Words Buddha Used To Summarize 84,000 Teachings Which Could Upgrade Every Moment Of Your Life",0,word/Words buddha/Buddha use/Used summar/Summarize teach/Teachings could/Could upgrad/Upgrade everi/Every moment/Moment life/Life
Maximizing Productivity and Wellness: A Holistic Approach,0,maxim/Maximizing product/Productivity well/Wellness holist/Holistic approach/Approach
"The Hidden Key to Informal Meditation: Unlock Your Brain’s Urge to Be Happy Anytime, Anywhere",0,hidden/Hidden key/Key inform/Informal medit/Meditation unlock/Unlock brain/Brains urg/Urge happi/Happy anytim/Anytime anywher/Anywhere
Buddha’s Warning About Ten Blockages To Happiness Will Turn Your Search For It Upside Down,0,buddha/Buddhas warn/Warning ten/Ten blockag/Blockages happi/Happiness turn/Turn search/Search upsid/Upside
One of My Strange Experiences: The Grid,0,one/One strang/Strange experi/Experiences grid/Grid
Experiment your way to a better life,0,experi/Experiment way/Way better/Better life/Life
Breaking Free From Diabetes,0,break/Breaking free/Free diabet/Diabetes
Beets Have More Nitrates Than Salami. So Why Is Deli Meat Unhealthy?,0,beet/Beets nitrat/Nitrates salami/Salami deli/Deli meat/Meat unhealthi/Unhealthy
"What is Coconut Water, and why has it Gained so Much Popularity?",0,coconut/Coconut water/Water gain/Gained much/Much popular/Popularity
Helping children eat healthier foods may begin with getting parents to do the same,0,help/Helping children/Children eat/Eat healthier/Healthier food/Foods may/May begin/Begin get/Getting parent/Parents
Psychologic Hunger is all too Real,0,psycholog/Psychologic hunger/Hunger real/Real
Politically Not-So-Correct Cuisine To Improve Your Diet,0,polit/Politically notsocorrect/Notsocorrect cuisin/Cuisine improv/Improve diet/Diet
The Blood-Pressure Danger of… Licorice?,0,bloodpressur/Bloodpressure danger/Danger licoric/Licorice
The 6ft6 Method: A Critical Review,0,6ft6/6Ft6 method/Method critic/Critical review/Review
I Am Not My Thoughts: Dostoyevsky Speaks: And Three Stage Elbow Care,0,thought/Thoughts dostoyevski/Dostoyevsky speak/Speaks three/Three stage/Stage elbow/Elbow care/Care
Mental Health Stigma,0,mental/Mental health/Health stigma/Stigma
The ER Visit That Changed My Life,0,er/Er visit/Visit chang/Changed life/Life
What Happens When You Start Reading Every Day,0,happen/Happens start/Start read/Reading everi/Every day/Day
Depression House. Again.,0,depress/Depression hous/House
Kindness Protects DNA and Boosts Health and Happiness,0,kind/Kindness protect/Protects dna/Dna boost/Boosts health/Health happi/Happiness
The Complex Nexus Between High Intelligence and Mental Health: A Comprehensive Exploration,0,complex/Complex nexu/Nexus high/High intellig/Intelligence mental/Mental health/Health comprehens/Comprehensive explor/Exploration
How Knowledge Became My Enemy — Contending Against What Murdered My Passion And Self,0,knowledg/Knowledge becam/Became enemi/Enemy contend/Contending murder/Murdered passion/Passion self/Self
Come Find Me by the Water,0,come/Come find/Find water/Water
Absurdism: The Philosophy That Changed My Mindset,0,absurd/Absurdism philosophi/Philosophy chang/Changed mindset/Mindset
Childhood Trauma and Neglect Don’t Need to be Fatal,0,childhood/Childhood trauma/Trauma neglect/Neglect dont/Dont need/Need fatal/Fatal
"Do Fat Burners Really Work, Or Is It Money Down The Toilet?",0,fat/Fat burner/Burners realli/Really work/Work money/Money toilet/Toilet
Vitamin D Supplementation Is A Double-Edged Sword,0,vitamin/Vitamin supplement/Supplementation doubleedg/Doubleedged sword/Sword
30+ Days of Taking Shilajit — Here’s My Brutally Honest Review,0,day/Days take/Taking shilajit/Shilajit here/Heres brutal/Brutally honest/Honest review/Review
Supplements VS. Food,0,supplement/Supplements vs/Vs food/Food
Chronic Pain and the Kratom Controversy,0,chronic/Chronic pain/Pain kratom/Kratom controversi/Controversy
Dr. Andrew Huberman’s Supplement Recommendations,0,dr/Dr andrew/Andrew huberman/Hubermans supplement/Supplement recommend/Recommendations
"Ephedrine: Uses, Effects, and Risks",0,ephedrin/Ephedrine use/Uses effect/Effects risk/Risks
"What is Colostrum, And Should I Be Drinking It?",0,colostrum/Colostrum drink/Drinking
Struggle With Digestive Issues? Read This Before Investing In Another Gut Reset Supplement,0,struggl/Struggle digest/Digestive issu/Issues read/Read invest/Investing anoth/Another gut/Gut reset/Reset supplement/Supplement
Unlocking the Power of Nature: A Comprehensive Guide to Supporting Healthy Blood Sugar Levels,0,unlock/Unlocking power/Power natur/Nature comprehens/Comprehensive guid/Guide support/Supporting healthi/Healthy blood/Blood sugar/Sugar level/Levels
One Tip I Wish I Could Get Anyone Who’s Struggling With Weight Loss to Read.,0,one/One tip/Tip wish/Wish could/Could get/Get anyon/Anyone who/Whos struggl/Struggling weight/Weight loss/Loss read/Read
"60-plus and Since I Started Intermittent Fasting, The Most Curious Thing Has Happened",0,60plu/60Plus sinc/Since start/Started intermitt/Intermittent fast/Fasting curiou/Curious thing/Thing happen/Happened
Unveiling the Science Behind the Simple ‘Coffee Hack’ for Metabolism Boost and Belly Fat Release,0,unveil/Unveiling scienc/Science behind/Behind simpl/Simple coffe/Coffee hack/Hack metabol/Metabolism boost/Boost belli/Belly fat/Fat releas/Release
Fertility Rises with Weight Loss Drugs like Ozempic and Wegovy,0,fertil/Fertility rise/Rises weight/Weight loss/Loss drug/Drugs like/Like ozemp/Ozempic wegovi/Wegovy
Is Intermittent Fasting Killing People?,0,intermitt/Intermittent fast/Fasting kill/Killing peopl/People
I Was Never Good At Sports,0,never/Never good/Good sport/Sports
Do Weight Loss Drugs Enable Lousy Eating Habits?,0,weight/Weight loss/Loss drug/Drugs enabl/Enable lousi/Lousy eat/Eating habit/Habits
I Swapped 20 Pounds Of Fat For 20 Pounds Of Muscle — Here’s How.,0,swap/Swapped pound/Pounds fat/Fat pound/Pounds muscl/Muscle here/Heres
No one knows what obesity is,0,one/One know/Knows obes/Obesity
The Habit Coach Wrap — March🌯,0,habit/Habit coach/Coach wrap/Wrap march/March
How to Create an Online Coaching Business in 2024,0,creat/Create onlin/Online coach/Coaching busi/Business
The Secret Sauce to Optimal Health and Fitness with DFit Training Studio,0,secret/Secret sauc/Sauce optim/Optimal health/Health fit/Fitness dfit/Dfit train/Training studio/Studio
New to Personal Training? Avoid the Disrespectful Client Bear Trap,0,new/New person/Personal train/Training avoid/Avoid disrespect/Disrespectful client/Client bear/Bear trap/Trap
7 things YOU MUST KNOW before becoming a PERSONAL TRAINER!,0,thing/Things must/Must know/Know becom/Becoming person/Personal trainer/Trainer
Signs of Vitamin Deficiency and Toxicity,0,sign/Signs vitamin/Vitamin defici/Deficiency toxic/Toxicity
Out of the Box,0,box/Box
What Challenging Clients Teach You as a Personal Trainer,0,challeng/Challenging client/Clients teach/Teach person/Personal trainer/Trainer
What I WISH I Knew Before Becoming A Personal Trainer,0,wish/Wish knew/Knew becom/Becoming person/Personal trainer/Trainer
